DATE,NAME,COMMITTEE,CATEGORY
2016-03-22,AN OVERVIEW OF THE BUDGET PROPOSAL FOR THE NATIONAL SCIENCE FOUNDATION FOR FISCAL YEAR 2017,"House Committee on Science, Space, and Technology",Legislative
2016-03-17,AN OVERVIEW OF THE BUDGET PROPOSAL FOR THE NATIONAL AERONAUTICS AND SPACE ADMINISTRATION FOR FISCAL YEAR 2017,"House Committee on Science, Space, and Technology",Legislative
2016-03-16,AN OVERVIEW OF THE BUDGET PROPOSAL FOR THE NATIONAL INSTITUTE OF STANDARDS AND TECHNOLOGY FOR FISCAL YEAR 2017,"House Committee on Science, Space, and Technology",Legislative
2016-03-16,AN OVERVIEW OF THE BUDGET PROPOSAL FOR THE NATIONAL OCEANIC AND ATMOSPHERIC ADMINISTRATION FOR FISCAL YEAR 2017,"House Committee on Science, Space, and Technology",Legislative
2016-03-15,RACING TO REGULATE: EPA'S LATEST OVERREACH ON AMATEUR DRIVERS,"House Committee on Science, Space, and Technology",Fact Finding
2016-03-03,DEPARTMENT OF ENERGY OVERSIGHT: THE DOE LOAN GUARANTEE PROGRAM,"House Committee on Science, Space, and Technology",Policy
2016-03-02,SMART HEALTH: EMPOWERING THE FUTURE OF MOBILE APPS,"House Committee on Science, Space, and Technology",Fact Finding
2016-02-04,A REVIEW OF RECOMMENDATIONS FOR NSF PROJECT MANAGEMENT REFORM,"House Committee on Science, Space, and Technology",Policy
2016-02-03,CHARTING A COURSE: EXPERT PERSPECTIVES ON NASA'S HUMAN EXPLORATION PROPOSALS,"House Committee on Science, Space, and Technology",Fact Finding
2016-01-08,CYBERSECURITY: WHAT THE FEDERAL GOVERNMENT CAN LEARN FROM THE PRIVATE SECTOR,"House Committee on Science, Space, and Technology",Fact Finding
2015-12-10,AN OVERVIEW OF THE NATION'S WEATHER SATELLITE PROGRAMS AND POLICIES,"House Committee on Science, Space, and Technology",Policy
2015-12-08,"THE FUTURE OF BIOTECHNOLOGY: SOLUTIONS FOR ENERGY, AGRICULTURE AND MANUFACTURING","House Committee on Science, Space, and Technology",Fact Finding
2015-12-03,"H.R. 4084, NUCLEAR ENERGY INNOVATION CAPABILITIES ACT","House Committee on Science, Space, and Technology",Legislative
2015-11-18,RECOMMENDATIONS OF THE COMMISSION TO REVIEW THE EFFECTIVENESS OF THE NATIONAL ENERGY LABORATORIES,"House Committee on Science, Space, and Technology",Fact Finding
2015-11-18,THE ADMINISTRATION'S EMPTY PROMISES FOR THE INTERNATIONAL CLIMATE TREATY,"House Committee on Science, Space, and Technology",Agency Conduct
2015-11-17,EXPLORING COMMERCIAL OPPORTUNITIES TO MAXIMIZE EARTH SCIENCE INVESTMENTS,"House Committee on Science, Space, and Technology",Policy
2015-11-03,THE RENEWABLE FUEL STANDARD: A TEN-YEAR REVIEW OF COSTS AND BENEFITS,"House Committee on Science, Space, and Technology",Policy
2015-10-28,A REVIEW OF THE NETWORKING AND INFORMATION TECHNOLOGY RESEARCH AND DEVELOPMENT (NITRD) PROGRAM,"House Committee on Science, Space, and Technology",Policy
2015-10-21,CYBERSECURITY FOR POWER SYSTEMS,"House Committee on Science, Space, and Technology",Policy
2015-10-09,DEEP SPACE EXPLORATION: EXAMINING THE IMPACT OF THE PRESIDENT'S BUDGET,"House Committee on Science, Space, and Technology",Legislative
2015-09-18,NEON WARNING SIGNS: EXAMINING THE MANAGEMENT OF THE NATIONAL ECOLOGICAL OBSERVATORY NETWORK,"House Committee on Science, Space, and Technology",Agency Conduct
2015-09-11,STATE PERSPECTIVES: HOW EPA'S POWER PLAN WILL SHUT DOWN POWER PLANTS,"House Committee on Science, Space, and Technology",Policy
2015-09-10,EXAMINING VULNERABILITIES OF AMERICA'S POWER SUPPLY,"House Committee on Science, Space, and Technology",Fact Finding
2015-07-29,A REVIEW OF THE NUCLEAR REGULATORY COMMISSION'S LICENSING PROCESS,"House Committee on Science, Space, and Technology",Policy
2015-07-23,THE EPA RENEWABLE FUEL STANDARD MANDATE,"House Committee on Science, Space, and Technology",Policy
2015-07-14,"ADVANCING COMMERCIAL WEATHER DATA: COLLABORATIVE EFFORTS TO IMPROVE FORECASTS, PART II","House Committee on Science, Space, and Technology",Policy
2015-07-10,THE INTERNATIONAL SPACE STATION: ADDRESSING OPERATIONAL CHALLENGES,"House Committee on Science, Space, and Technology",Policy
2015-07-08,IS THE OPM DATA BREACH THE TIP OF THE ICEBERG?,"House Committee on Science, Space, and Technology",Agency Conduct
2015-06-25,IS NSF PROPERLY MANAGING ITS ROTATING STAFF?,"House Committee on Science, Space, and Technology",Agency Conduct
2015-06-24,U.S. ENERGY INFORMATION ADMINISTRATION REPORT: ANALYSIS OF THE IMPACTS OF THE EPA'S CLEAN POWER PLAN,"House Committee on Science, Space, and Technology",Policy
2015-06-17,DEPARTMENT OF ENERGY OVERSIGHT: ENERGY INNOVATION HUBS,"House Committee on Science, Space, and Technology",Policy
2015-06-16,THE SCIENCE AND ETHICS OF GENETICALLY ENGINEERED HUMAN DNA,"House Committee on Science, Space, and Technology",Fact Finding
2015-06-12,U.S. SURFACE TRANSPORTATION: TECHNOLOGY DRIVING THE FUTURE,"House Committee on Science, Space, and Technology",Fact Finding
2015-06-11,TRANSFORMING AMERICA'S AIR TRAVEL,"House Committee on Science, Space, and Technology",Fact Finding
2015-05-20,ADVANCING COMMERCIAL WEATHER DATA: COLLABORATIVE EFFORTS TO IMPROVE FORECASTS,"House Committee on Science, Space, and Technology",Policy
2015-05-13,NUCLEAR ENERGY INNOVATION AND THE NATIONAL LABS,"House Committee on Science, Space, and Technology",Fact Finding
2015-05-01,INNOVATIONS IN BATTERY STORAGE FOR RENEWABLE ENERGY,"House Committee on Science, Space, and Technology",Fact Finding
2015-04-29,REALITY CHECK PART II: THE IMPACT OF EPA'S PROPOSED OZONE STANDARDS ON RURAL AMERICA,"House Committee on Science, Space, and Technology",Policy
2015-04-16,AN OVERVIEW OF THE BUDGET PROPOSAL FOR THE NATIONAL AERONAUTICS AND SPACE ADMINISTRATION FOR FISCAL YEAR 2016,"House Committee on Science, Space, and Technology",Legislative
2015-03-26,DESTRUCTION OF RECORDS AT EPA: WHEN RECORDS MUST BE KEPT,"House Committee on Science, Space, and Technology",Policy
2015-03-24,DEPARTMENT OF ENERGY OVERSIGHT: OFFICE OF ENERGY EFFICIENCY AND RENEWABLE ENERGY,"House Committee on Science, Space, and Technology",Policy
2015-03-24,SEARCHING FOR THE ORIGINS OF THE UNIVERSE: AN UPDATE ON THE PROGRESS OF THE JAMES WEBB SPACE TELESCOPE,"House Committee on Science, Space, and Technology",Policy
2015-02-27,THE COMMERCIAL CREW PROGRAM: CHALLENGES AND OPPORTUNITIES,"House Committee on Science, Space, and Technology",Policy
2015-02-26,AN OVERVIEW OF THE BUDGET PROPOSALS FOR THE NATIONAL SCIENCE FOUNDATION AND NATIONAL INSTITUTE OF STANDARDS AND TECHNOLOGY FOR FISCAL YEAR 2016,"House Committee on Science, Space, and Technology",Legislative
2015-02-12,BRIDGING THE GAP: AMERICA'S WEATHER SATELLITES AND WEATHER FORECASTING,"House Committee on Science, Space, and Technology",Policy
2015-02-12,CAN AMERICANS TRUST THE PRIVACY AND SECURITY OF THEIR INFORMATION ON HEALTHCARE.GOV?,"House Committee on Science, Space, and Technology",Agency Conduct
2015-02-03,NSF'S OVERSIGHT OF THE NEON PROJECT AND OTHER MAJOR RESEARCH FACILITIES DEVELOPED UNDER COOPERATIVE AGREEMENTS,"House Committee on Science, Space, and Technology",Agency Conduct
2015-01-28,SUPERCOMPUTING AND AMERICAN TECHNOLOGY LEADERSHIP,"House Committee on Science, Space, and Technology",Fact Finding
2015-01-27,THE EXPANDING CYBER THREAT,"House Committee on Science, Space, and Technology",Fact Finding
2014-12-11,THE FUTURE OF NUCLEAR ENERGY,"House Committee on Science, Space, and Technology",Fact Finding
2014-12-10,AN UPDATE ON THE SPACE LAUNCH SYSTEM AND ORION: MONITORING THE DEVELOPMENT OF THE NATION'S DEEP SPACE EXPLORATION CAPABILITIES,"House Committee on Science, Space, and Technology",Policy
2014-11-19,THE ROLE OF THE WHITE HOUSE CHIEF TECHNOLOGY OFFICER IN THE HEALTHCARE.GOV WEBSITE DEBACLE,"House Committee on Science, Space, and Technology",Agency Conduct
2014-09-10,EXPLORING OUR SOLAR SYSTEM: THE ASTEROIDS ACT AS A KEY STEP,"House Committee on Science, Space, and Technology",Legislative
2014-09-09,BAKKEN PETROLEUM: THE SUBSTANCE OF ENERGY INDEPENDENCE,"House Committee on Science, Space, and Technology",Fact Finding
2014-09-09,STRATEGY AND MISSION OF THE DHS SCIENCE AND TECHNOLOGY DIRECTORATE,"House Committee on Science, Space, and Technology",Policy
2014-07-31,TECHNOLOGY NEEDED TO SECURE AMERICA'S BORDER,"House Committee on Science, Space, and Technology",Fact Finding
2014-07-29,A REVIEW OF THE NATIONAL EARTHQUAKE,"House Committee on Science, Space, and Technology",Policy
2014-07-17,POLICIES TO SPUR INNOVATIVE MEDICAL,"House Committee on Science, Space, and Technology",Policy
2014-07-16,STATUS OF REFORMS TO EPA'S INTEGRATED RISK INFORMATION SYSTEM,"House Committee on Science, Space, and Technology",Policy
2014-07-11,FUSION: THE WORLD'S MOST COMPLEX ENERGY PROJECT,"House Committee on Science, Space, and Technology",Policy
2014-06-26,TECHNOLOGY FOR PATIENT SAFETY AT VETERANS HOSPITALS,"House Committee on Science, Space, and Technology",Fact Finding
2014-06-20,NASA SECURITY: ASSESSING THE AGENCY'S,"House Committee on Science, Space, and Technology",Policy
2014-06-18,THE FUTURE OF SURFACE TRANSPORTATION,"House Committee on Science, Space, and Technology",Fact Finding
2014-06-12,REDUCING THE ADMINISTRATIVE WORKLOAD,"House Committee on Science, Space, and Technology",Policy
2014-06-10,A REVIEW OF THE P5: THE U.S. VISION FOR PARTICLE PHYSICS AFTER DISCOVERY OF THE HIGGS BOSON,"House Committee on Science, Space, and Technology",Policy
2014-05-20,NANOTECHNOLOGY: FROM LABORATORIES TO COMMERCIAL PRODUCTS,"House Committee on Science, Space, and Technology",Policy
2014-05-09,SPACE TRAFFIC MANAGEMENT: HOW TO PREVENT A REAL LIFE ``GRAVITY'',"House Committee on Science, Space, and Technology",Policy
2014-04-30,AN OVERVIEW OF THE NATIONAL OCEANIC AND ATMOSPHERIC ADMINISTRATION BUDGET REQUEST FOR FISCAL YEAR 2015,"House Committee on Science, Space, and Technology",Legislative
2014-04-09,PRIZES TO SPUR INNOVATION AND TECHNOLOGY BREAKTHROUGHS,"House Committee on Science, Space, and Technology",Policy
2014-03-27,A REVIEW OF THE NATIONAL AERONAUTICS,"House Committee on Science, Space, and Technology",Policy
2014-03-12,SCIENCE OF CAPTURE AND STORAGE: UNDERSTANDING EPA'S CARBON RULES,"House Committee on Science, Space, and Technology",Policy
2014-03-06,CAN TECHNOLOGY PROTECT AMERICANS FROM INTERNATIONAL CYBERCRIMINALS?,"House Committee on Science, Space, and Technology",Fact Finding
2014-02-11,ENSURING OPEN SCIENCE AT EPA,"House Committee on Science, Space, and Technology",Policy
2014-02-04,NECESSARY UPDATES TO THE COMMERCIAL SPACE LAUNCH ACT,"House Committee on Science, Space, and Technology",Policy
2014-01-14,SCIENTIFIC RESEARCH AT THE SMITHSONIAN,"House Committee on Science, Space, and Technology",Fact Finding
2014-01-09,PRIVATE SECTOR PROGRAMS THAT ENGAGE STUDENTS IN STEM,"House Committee on Science, Space, and Technology",Fact Finding
2013-12-12,BUILDING A NETWORK FOR MANUFACTURING INNOVATION,"House Committee on Science, Space, and Technology",Fact Finding
2013-12-11,A FACTUAL LOOK AT THE RELATIONSHIP BETWEEN CLIMATE AND WEATHER,"House Committee on Science, Space, and Technology",Fact Finding
2013-11-20,COMMERCIAL SPACE,"House Committee on Science, Space, and Technology",Policy
2013-11-13,"KEEPING AMERICA FIRST: FEDERAL INVESTMENTS IN RESEARCH, SCIENCE, AND TECHNOLOGY AT NSF, NIST, OSTP, AND INTERAGENCY STEM PROGRAMS","House Committee on Science, Space, and Technology",Legislative
2013-10-30,PROVIDING THE TOOLS FOR SCIENTIFIC DISCOVERY AND BASIC ENERGY RESEARCH: THE DEPARTMENT OF ENERGY SCIENCE MISSION,"House Committee on Science, Space, and Technology",Policy
2013-10-29,EPA POWER PLANT REGULATIONS: IS THE TECHNOLOGY READY?,"House Committee on Science, Space, and Technology",Policy
2013-09-20,NASA INFRASTRUCTURE: ENABLING DISCOVERY AND ENSURING CAPABILITY,"House Committee on Science, Space, and Technology",Policy
2013-09-19,DYSFUNCTION IN MANAGEMENT OF WEATHER AND CLIMATE SATELLITES,"House Committee on Science, Space, and Technology",Policy
2013-09-18,METHAMPHETAMINE ADDICTION: USING SCIENCE TO EXPLORE SOLUTIONS,"House Committee on Science, Space, and Technology",Fact Finding
2013-09-10,EXAMINING FEDERAL ADVANCED MANUFACTURING PROGRAMS,"House Committee on Science, Space, and Technology",Policy
2013-08-01,EPA'S BRISTOL BAY WATERSHED ASSESSMENT: A FACTUAL REVIEW OF A HYPOTHETICAL SCENARIO,"House Committee on Science, Space, and Technology",Agency Conduct
2013-07-31,THE FRONTIERS OF HUMAN BRAIN RESEARCH,"House Committee on Science, Space, and Technology",Fact Finding
2013-07-25,THE FUTURE OF COAL: UTILIZING AMERICA'S ABUNDANT ENERGY RESOURCES,"House Committee on Science, Space, and Technology",Fact Finding
2013-07-24,"IMPROVING TECHNOLOGY TRANSFER AT UNIVERSITIES, RESEARCH INSTITUTES, AND NATIONAL LABORATORIES","House Committee on Science, Space, and Technology",Legislative
2013-07-24,LESSONS LEARNED: EPA'S INVESTIGATIONS OF HYDRAULIC FRACTURING,"House Committee on Science, Space, and Technology",Agency Conduct
2013-07-11,OVERSIGHT AND MANAGEMENT OF DEPARTMENT OF ENERGY NATIONAL LABORATORIES AND SCIENCE ACTIVITIES,"House Committee on Science, Space, and Technology",Policy
2013-07-10,STRATEGIC PLANNING FOR NATIONAL MANUFACTURING COMPETITIVENESS,"House Committee on Science, Space, and Technology",Fact Finding
2013-06-27,GREEN BUILDINGSâ€”AN EVALUATION OF ENERGY SAVINGS PERFORMANCE CONTRACTS,"House Committee on Science, Space, and Technology",Policy
2013-06-26,RESTORING U.S. LEADERSHIP IN WEATHER FORECASTING PART II,"House Committee on Science, Space, and Technology",Fact Finding
2013-06-19,THE NASA AUTHORIZATION ACT OF 2013,"House Committee on Science, Space, and Technology",Meeting/Markup
2013-06-12,BACKGROUND CHECK: ACHIEVABILITY OF NEW OZONE STANDARDS,"House Committee on Science, Space, and Technology",Policy
2013-06-05,FEDERAL EFFORTS TO REDUCE THE IMPACTS OF WINDSTORMS,"House Committee on Science, Space, and Technology",Fact Finding
2013-05-22,AMERICA'S NEXT GENERATION SUPERCOMPUTER: THE EXASCALE CHALLENGE,"House Committee on Science, Space, and Technology",Fact Finding
2013-05-21,NEXT STEPS IN HUMAN EXPLORATION TO MARS AND BEYOND,"House Committee on Science, Space, and Technology",Policy
2013-05-21,THE CURRENT AND FUTURE APPLICATIONS OF BIOMETRIC TECHNOLOGIES,"House Committee on Science, Space, and Technology",Fact Finding
2013-05-16,ESPIONAGE THREATS AT FEDERAL LABORATORIES: BALANCING SCIENTIFIC COOPERATION WHILE PROTECTING CRITICAL INFORMATION,"House Committee on Science, Space, and Technology",Fact Finding
2013-05-09,EXOPLANET DISCOVERIES: HAVE WE FOUND OTHER EARTHS?,"House Committee on Science, Space, and Technology",Fact Finding
2013-04-26,REVIEW OF FEDERAL HYDRAULIC FRACTURING RESEARCH ACTIVITIES,"House Committee on Science, Space, and Technology",Agency Conduct
2013-04-25,POLICY RELEVANT CLIMATE ISSUES IN CONTEXT,"House Committee on Science, Space, and Technology",Fact Finding
2013-04-24,AN OVERVIEW OF THE NATIONAL AERONAUTICS AND SPACE ADMINISTRATION BUDGET FOR FISCAL YEAR 2014,"House Committee on Science, Space, and Technology",Legislative
2013-04-24,NEXT GENERATION COMPUTING AND BIG DATA ANALYTICS,"House Committee on Science, Space, and Technology",Fact Finding
2013-04-18,AN OVERVIEW OF THE FISCAL YEAR 2014 BUDGET PROPOSAL AT THE NATIONAL INSTITUTE OF STANDARDS AND TECHNOLOGY (NIST),"House Committee on Science, Space, and Technology",Legislative
2013-04-17,A REVIEW OF THE PRESIDENT'S FY 2014 BUDGET REQUEST FOR SCIENCE AGENCIES,"House Committee on Science, Space, and Technology",Legislative
2013-04-17,AN OVERVIEW OF THE NATIONAL SCIENCE FOUNDATION BUDGET FOR FISCAL YEAR 2014,"House Committee on Science, Space, and Technology",Legislative
2013-03-20,EXAMINING THE EFFECTIVENESS OF THE NIST LABORATORIES,"House Committee on Science, Space, and Technology",Policy
2013-03-20,IMPROVING EPA'S SCIENTIFIC ADVISORY PROCESSES,"House Committee on Science, Space, and Technology",Policy
2013-03-13,FEDERAL FINANCIAL SUPPORT FOR ENERGY TECHNOLOGIES: ASSESSING COSTS AND BENEFITS,"House Committee on Science, Space, and Technology",Fact Finding
2013-03-13,STEM EDUCATION: INDUSTRY AND PHILANTHROPIC INITIATIVES,"House Committee on Science, Space, and Technology",Fact Finding
2013-03-05,SCIENTIFIC INTEGRITY AND TRANSPARENCY,"House Committee on Science, Space, and Technology",Policy
2013-02-28,TOP CHALLENGES FOR SCIENCE AGENCIES: REPORTS FROM THE INSPECTORS GENERAL (PART I AND PART II),"House Committee on Science, Space, and Technology",Agency Conduct
2013-02-27,A REVIEW OF THE SPACE LEADERSHIP PRESERVATION ACT,"House Committee on Science, Space, and Technology",Legislative
2013-02-26,CYBERSECURITY RESEARCH AND DEVELOPMENT: CHALLENGES AND SOLUTIONS,"House Committee on Science, Space, and Technology",Fact Finding
2013-02-26,MID-LEVEL ETHANOL BLENDS: CONSUMER AND TECHNICAL RESEARCH NEEDS,"House Committee on Science, Space, and Technology",Policy
2013-02-15,OPERATING UNMANNED AIRCRAFT SYSTEMS IN THE NATIONAL AIRSPACE SYSTEM: ASSESSING RESEARCH AND DEVELOPMENT EFFORTS TO ENSURE SAFETY,"House Committee on Science, Space, and Technology",Fact Finding
2013-02-14,APPLICATIONS FOR INFORMATION TECHNOLOGY RESEARCH & DEVELOPMENT,"House Committee on Science, Space, and Technology",Fact Finding
2013-02-14,THE STATE OF THE ENVIRONMENT: EVALUATING PROGRESS AND PRIORITIES,"House Committee on Science, Space, and Technology",Policy
2013-02-13,"AMERICAN ENERGY OUTLOOK: TECHNOLOGY, MARKET AND POLICY DRIVERS","House Committee on Science, Space, and Technology",Fact Finding
2012-12-05,THE IMPACT OF INTERNATIONAL TECHNOLOGY TRANSFER ON AMERICAN RESEARCH AND DEVELOPMENT,"House Committee on Science, Space, and Technology",Fact Finding
2012-11-30,TAPPING AMERICA'S ENERGY POTENTIAL THROUGH RESEARCH AND DEVELOPMENT,"House Committee on Science, Space, and Technology",Fact Finding
2012-11-28,NATIONAL PRIORITIES FOR SOLAR AND SPACE PHYSICS RESEARCH AND APPLICATIONS FOR SPACE WEATHER PREDICTION,"House Committee on Science, Space, and Technology",Fact Finding
2012-11-14,IS ``MEANINGFUL USE'' DELIVERING MEANINGFUL RESULTS?: AN EXAMINATION OF HEALTH INFORMATION TECHNOLOGY STANDARDS AND INTEROPERABILITY,"House Committee on Science, Space, and Technology",Policy
2012-09-12,EXAMINING NASA'S DEVELOPMENT ON THE SPACE LAUNCH SYSTEM AND ORION CREW CAPSULE,"House Committee on Science, Space, and Technology",Policy
2012-09-12,MISMANAGEMENT OF FUNDS AT THE NATIONAL WEATHER SERVICE AND THE IMPACT ON THE FUTURE OF WEATHER FORECASTING,"House Committee on Science, Space, and Technology",Agency Conduct
2012-08-01,THE EMERGING COMMERCIAL SUBORBITAL REUSABLE LAUNCH VEHICLE MARKET,"House Committee on Science, Space, and Technology",Fact Finding
2012-08-01,THE RELATIONSHIP BETWEEN BUSINESS AND RESEARCH UNIVERSITIES: COLLABORATIONS FUELING AMERICAN INNOVATION AND JOB CREATION,"House Committee on Science, Space, and Technology",Fact Finding
2012-07-26,REVIEW OF DOE VEHICLE TECHNOLOGIES PROGRAM MANAGEMENT AND ACTIVITIES: ASSURING APPROPRIATE AND EFFECTIVE USE OF TAXPAYER FUNDING,"House Committee on Science, Space, and Technology",Agency Conduct
2012-07-16,INNOVATION CORPS: A REVIEW OF A NEW NATIONAL SCIENCE FOUNDATION PROGRAM TO LEVERAGE RESEARCH INVESTMENTS,"House Committee on Science, Space, and Technology",Policy
2012-07-12,SPURRING ECONOMIC GROWTH AND COMPETITIVENESS THROUGH NASA-DERIVED TECHNOLOGIES,"House Committee on Science, Space, and Technology",Fact Finding
2012-06-27,THE ROLE OF RESEARCH UNIVERSITIES IN SECURING AMERICA'S FUTURE PROSPERITY: CHALLENGES AND EXPECTATIONS,"House Committee on Science, Space, and Technology",Fact Finding
2012-06-21,DEPARTMENT OF ENERGY USER FACILITIES: UTILIZING THE TOOLS OF SCIENCE TO DRIVE INNOVATION THROUGH FUNDAMENTAL RESEARCH,"House Committee on Science, Space, and Technology",Fact Finding
2012-06-19,BEST PRACTICES IN TRANSFORMING RESEARCH INTO INNOVATION; CREATIVE APPROACHES TO THE BAYH-DOYLE ACT,"House Committee on Science, Space, and Technology",Fact Finding
2012-06-19,THE SCIENCE OF HOW HUNTING ASSISTS SPECIES CONSERVATION AND MANAGEMENT,"House Committee on Science, Space, and Technology",Policy
2012-06-06,AN EXAMINATION OF FUTURE COMMERCIAL LAUNCH MARKETS AND FAA'S LAUNCH INDEMNIFICATION PROGRAM,"House Committee on Science, Space, and Technology",Policy
2012-06-06,EPA'S IMPACT ON JOBS AND ENERGY AFFORDABILITY: UNDERSTANDING THE REAL COSTS AND BENEFITS OF ENVIRONMENTAL REGULATIONS,"House Committee on Science, Space, and Technology",Policy
2012-05-31,ASSEMBLING THE FACTS: EXAMINING THE PROPOSED NATIONAL NETWORK FOR MANUFACTURING INNOVATION,"House Committee on Science, Space, and Technology",Fact Finding
2012-05-17,WORKING FOR A FIRE SAFE AMERICA: EXAMINING UNITED STATES FIRE ADMINISTRATION PRIORITIES,"House Committee on Science, Space, and Technology",Policy
2012-05-10,SUPPORTING AMERICAN JOBS AND THE ECONOMY THROUGH EXPANDED ENERGY PRODUCTION: CHALLENGES AND OPPORTUNITIES OF UNCONVENTIONAL RESOURCES TECHNOLOGY,"House Committee on Science, Space, and Technology",Fact Finding
2012-05-09,ENSURING THE BEST STEWARDSHIP OF AMERICAN TAXPAYER DOLLARS AT THE NATIONAL SCIENCE FOUNDATION,"House Committee on Science, Space, and Technology",Fact Finding
2012-05-08,THE SCIENCE BEHIND GREEN BUILDING RATING SYSTEMS,"House Committee on Science, Space, and Technology",Policy
2012-04-30,"STEM EDUCATION IN ACTION: LOCAL SCHOOLS, NONPROFITS, AND BUSINESSES DOING THEIR PART TO SECURE AMERICA'S FUTURE","House Committee on Science, Space, and Technology",Fact Finding
2012-04-26,AN OVERVIEW OF THE NASA AERONAUTICS RESEARCH MISSION DIRECTORATE BUDGET FOR FISCAL YEAR 2013,"House Committee on Science, Space, and Technology",Legislative
2012-04-25,"HOW THE REPORT ON CARCINOGENS USES SCIENCE TO MEET ITS STATUTORY OBLIGATIONS, AND ITS IMPACT ON SMALL BUSINESS JOBS","House Committee on Science, Space, and Technology",Policy
2012-04-18,AVOIDING THE SPECTRUM CRUNCH: GROWING THE WIRELESS ECONOMY THROUGH INNOVATION,"House Committee on Science, Space, and Technology",Fact Finding
2012-04-18,NSF MAJOR MULTI-USER RESEARCH FACILITIES MANAGEMENT: ENSURING FISCAL RESPONSIBILITY AND ACCOUNTABILITY,"House Committee on Science, Space, and Technology",Policy
2012-03-29,FEDERALLY FUNDED RESEARCH: EXAMINING PUBLIC ACCESS AND SCHOLARLY PUBLICATION INTERESTS,"House Committee on Science, Space, and Technology",Fact Finding
2012-03-28,SECURING THE PROMISE OF THE INTERNATIONAL SPACE STATION: CHALLENGES AND OPPORTUNITIES,"House Committee on Science, Space, and Technology",Policy
2012-03-28,TO OBSERVE AND PROTECT: HOW NOAA PROCURES DATA FOR WEATHER FORECASTING,"House Committee on Science, Space, and Technology",Policy
2012-03-27,"FOSTERING THE U.S. COMPETITIVE EDGE: EXAMINING THE EFFECT OF FEDERAL POLICIES ON COMPETITION, INNOVATION, AND JOB GROWTH","House Committee on Science, Space, and Technology",Agency Conduct
2012-03-20,AN OVERVIEW OF THE OFFICE OF COMMERCIAL SPACE TRANSPORTATION'S BUDGET FOR FISCAL YEAR 2013,"House Committee on Science, Space, and Technology",Legislative
2012-03-08,NSF MAJOR RESEARCH EQUIPMENT AND FACILITIES MANAGEMENT: ENSURING FISCAL RESPONSIBILITY AND ACCOUNTABILITY,"House Committee on Science, Space, and Technology",Legislative
2012-03-06,AN OVERVIEW OF THE NATIONAL OCEANIC AND ATMOSPHERIC ADMINISTRATION AND THE ENVIRONMENTAL PROTECTION AGENCY BUDGETS FOR FISCAL YEAR 2013,"House Committee on Science, Space, and Technology",Legislative
2012-03-06,OVERVIEW OF THE NATIONAL INSTITUTE OF STANDARDS AND TECHNOLOGY BUDGET FOR FISCAL YEAR 2013,"House Committee on Science, Space, and Technology",Legislative
2012-02-29,NASA CYBERSECURITY: AN EXAMINATION OF THE AGENCY'S INFORMATION SECURITY,"House Committee on Science, Space, and Technology",Policy
2012-02-29,"PROMOTING INNOVATION, COMPETITION AND ECONOMIC GROWTH: PRINCIPLES FOR EFFECTIVE DOMESTIC AND INTERNATIONAL STANDARDS DEVELOPMENT","House Committee on Science, Space, and Technology",Fact Finding
2012-02-28,AN OVERVIEW OF THE NATIONAL SCIENCE FOUNDATION BUDGET FOR FISCAL YEAR 2013,"House Committee on Science, Space, and Technology",Legislative
2012-02-01,FRACTURED SCIENCE: EXAMINING EPA'S APPROACH TO GROUNDWATER RESEARCH: THE PAVILLION ANALYSIS,"House Committee on Science, Space, and Technology",Policy
2012-01-24,A REVIEW OF THE ADVANCED RESEARCH PROJECTS AGENCY,"House Committee on Science, Space, and Technology",Meeting/Markup
2011-12-07,ENERGY CRITICAL ELEMENTS: IDENTIFYING RESEARCH NEEDS AND STRATEGIC PRIORITIES,"House Committee on Science, Space, and Technology",Fact Finding
2011-11-30,"STIMULUS OVERSIGHT: AN UPDATE ON ACCOUNTABILITY, TRANSPARENCY, AND PERFORMANCE","House Committee on Science, Space, and Technology",Agency Conduct
2011-11-17,FOSTERING QUALITY SCIENCE AT EPA: THE NEED FOR COMMON SENSE REFORM,"House Committee on Science, Space, and Technology",Agency Conduct
2011-11-15,EXPLORING MARS AND BEYOND: WHAT'S NEXT FOR U.S. PLANETARY SCIENCE,"House Committee on Science, Space, and Technology",Policy
2011-11-03,STEM IN ACTION: TRANSFERRING KNOWLEDGE FROM THE WORKPLACE TO THE CLASSROOM,"House Committee on Science, Space, and Technology",Policy
2011-11-02,CONFLICTS AND UNINTENDED CONSEQUENCES OF MOTOR FUEL STANDARDS,"House Committee on Science, Space, and Technology",Policy
2011-11-02,CREATING AND GROWING NEW BUSINESSES: FOSTERING U.S. INNOVATION,"House Committee on Science, Space, and Technology",Fact Finding
2011-10-13,ADVANCING COAL RESEARCH AND DEVELOPMENT FOR A SECURE ENERGY FUTURE,"House Committee on Science, Space, and Technology",Fact Finding
2011-10-13,THE ENDANGERED SPECIES ACT: REVIEWING THE NEXUS OF SCIENCE AND POLICY,"House Committee on Science, Space, and Technology",Policy
2011-10-12,LESSONS FROM THE SOYUZ ROCKET FAILURE AND RETURN TO FLIGHT,"House Committee on Science, Space, and Technology",Agency Conduct
2011-10-12,WHAT MAKES FOR SUCCESSFUL K-12 STEM EDUCATION: A CLOSER LOOK AT EFFECTIVE STEM EDUCATION APPROACHES,"House Committee on Science, Space, and Technology",Fact Finding
2011-10-04,QUALITY SCIENCE FOR QUALITY AIR,"House Committee on Science, Space, and Technology",Fact Finding
