DATE,NAME,COMMITTEE,CATEGORY
2011-10-12,H.R. 1418: THE SMALL BUSINESS LENDING ENHANCEMENT ACT OF 2011,House Committee on Financial Services,Legislative
2011-10-12,OVERSIGHT OF THE FEDERAL HOME LOAN BANK SYSTEM,House Committee on Financial Services,Policy
2011-10-06,THE ANNUAL REPORT OF THE FINANCIAL STABILITY OVERSIGHT COUNCIL,House Committee on Financial Services,Policy
2011-10-06,THE OBAMA ADMINISTRATION'S RESPONSE TO THE HOUSING CRISIS,House Committee on Financial Services,Policy
2011-10-04,"AUDIT THE FED: DODD-FRANK, QE3, AND FEDERAL RESERVE TRANSPARENCY",House Committee on Financial Services,Fact Finding
2011-10-04,THE WORLD BANK AND MULTILATERAL DEVELOPMENT BANKS' AUTHORIZATION,House Committee on Financial Services,Fact Finding
2011-09-22,AN EXAMINATION OF THE AVAILABILITY OF CREDIT FOR CONSUMERS,House Committee on Financial Services,Fact Finding
2011-09-22,POTENTIAL CONFLICTS OF INTEREST AT THE SEC: THE BECKER CASE,House Committee on Financial Services,Policy
2011-09-21,LEGISLATIVE PROPOSALS TO FACILITATE SMALL BUSINESS CAPITAL FORMATION AND JOB CREATION,House Committee on Financial Services,Legislative
2011-09-21,THE IMPACT OF THE WORLD BANK AND MULTILATERAL DEVELOPMENT BANKS ON NATIONAL SECURITY,House Committee on Financial Services,Fact Finding
2011-09-15,FIXING THE WATCHDOG: LEGISLATIVE PROPOSALS TO IMPROVE AND ENHANCE THE SECURITIES AND EXCHANGE COMMISSION,House Committee on Financial Services,Legislative
2011-09-14,CYBERSECURITY: THREATS TO THE FINANCIAL SECTOR,House Committee on Financial Services,Fact Finding
2011-09-14,HUD AND NEIGHBORWORKS HOUSING COUNSELING OVERSIGHT,House Committee on Financial Services,Policy
2011-09-13,ENSURING APPROPRIATE REGULATORY OVERSIGHT OF BROKER-DEALERS AND LEGISLATIVE PROPOSALS TO IMPROVE INVESTMENT ADVISER OVERSIGHT,House Committee on Financial Services,Legislative
2011-09-13,ROAD MAP TO SOUND MONEY: A LEGISLATIVE HEARING ON H.R. 1098 AND RESTORING THE DOLLAR,House Committee on Financial Services,Legislative
2011-09-08,"LEGISLATIVE PROPOSALS TO DETERMINE THE FUTURE ROLE OF FHA, RHS, AND GNMA IN THE SINGLE- AND MULTI-FAMILY MORTGAGE MARKETS, PART 2",House Committee on Financial Services,Legislative
2011-09-07,FACILITATING CONTINUED INVESTOR DEMAND IN THE U.S. MORTGAGE MARKET WITHOUT A GOVERNMENT GUARANTEE,House Committee on Financial Services,Fact Finding
2011-08-16,POTENTIAL MIXED MESSAGES: IS GUIDANCE FROM WASHINGTON BEING IMPLEMENTED BY FEDERAL BANK EXAMINERS?,House Committee on Financial Services,Fact Finding
2011-07-28,"INSURANCE OVERSIGHT: POLICY IMPLICATIONS FOR U.S. CONSUMERS, BUSINESSES, AND JOBS",House Committee on Financial Services,Policy
2011-07-27,OVERSIGHT OF THE CREDIT RATING AGENCIES POST-DODD-FRANK,House Committee on Financial Services,Policy
2011-07-27,THE IMPACT OF THE WORLD BANK AND MULTILATERAL DEVELOPMENT BANKS ON U.S. JOB CREATION,House Committee on Financial Services,Fact Finding
2011-07-26,EXAMINING RENTAL PURCHASE AGREEMENTS AND THE POTENTIAL ROLE FOR FEDERAL REGULATION,House Committee on Financial Services,Fact Finding
2011-07-26,"IMPACT OF MONETARY POLICY ON THE ECONOMY: A REGIONAL FED PERSPECTIVE ON INFLATION, UNEMPLOYMENT, AND QE3",House Committee on Financial Services,Fact Finding
2011-07-14,OVERSIGHT OF THE OFFICE OF FINANCIAL RESEARCH AND THE FINANCIAL STABILITY OVERSIGHT COUNCIL,House Committee on Financial Services,Policy
2011-07-13,MONETARY POLICY AND THE STATE OF THE ECONOMY,House Committee on Financial Services,Policy
2011-07-13,MORTGAGE ORIGINATION: THE IMPACT OF RECENT CHANGES ON HOMEOWNERS AND BUSINESSES,House Committee on Financial Services,Fact Finding
2011-07-08,LEGISLATIVE PROPOSALS REGARDING BANK EXAMINATION PRACTICES,House Committee on Financial Services,Legislative
2011-07-07,MORTGAGE SERVICING: AN EXAMINATION OF THE ROLE OF FEDERAL REGULATORS IN SETTLEMENT NEGOTIATIONS AND THE FUTURE OF MORTGAGE SERVICING STANDARDS,House Committee on Financial Services,Agency Conduct
2011-06-29,HACKED OFF: HELPING LAW ENFORCEMENT PROTECT PRIVATE FINANCIAL INFORMATION,House Committee on Financial Services,Policy
2011-06-24,OVERSIGHT OF THE MUTUAL FUND INDUSTRY: ENSURING MARKET STABILITY AND INVESTOR CONFIDENCE,House Committee on Financial Services,Fact Finding
2011-06-23,"INVESTIGATING THE GOLD: H.R. 1495, THE GOLD RESERVE TRANSPARENCY ACT OF 2011 AND THE OVERSIGHT OF UNITED STATES GOLD HOLDINGS",House Committee on Financial Services,Agency Conduct
2011-06-23,LEGISLATIVE PROPOSALS TO REFORM THE HOUSING CHOICE VOUCHER PROGRAM,House Committee on Financial Services,Legislative
2011-06-16,FINANCIAL REGULATORY REFORM: THE INTERNATIONAL CONTEXT,House Committee on Financial Services,Policy
2011-06-14,DOES THE DODD-FRANK ACT END ``TOO BIG TO FAIL?'',House Committee on Financial Services,Fact Finding
2011-06-14,THE ROLE OF THE U.S. IN THE WORLD BANK AND MULTILATERAL DEVELOPMENT BANKS: BANK OVERSIGHT AND REQUESTED CAPITAL INCREASES,House Committee on Financial Services,Fact Finding
2011-06-03,OVERSIGHT OF HUD'S HOME PROGRAM,House Committee on Financial Services,Policy
2011-06-01,"FEDERAL RESERVE LENDING DISCLOSURE: FOIA, DODD-FRANK, AND THE DATA DUMP",House Committee on Financial Services,Fact Finding
2011-05-26,FDIC OVERSIGHT: EXAMINING AND EVALUATING THE ROLE OF THE REGULATOR DURING THE FINANCIAL CRISIS AND TODAY,House Committee on Financial Services,Policy
2011-05-25,"TRANSPARENCY, TRANSITION, AND TAXPAYER PROTECTION: MORE STEPS TO END THE GSE BAILOUT",House Committee on Financial Services,Policy
2011-05-24,LEGISLATIVE PROPOSALS ON SECURING AMERICAN JOBS THROUGH EXPORTS: EXPORT-IMPORT BANK REAUTHORIZATION,House Committee on Financial Services,Legislative
2011-05-13,THE STANFORD PONZI SCHEME: LESSONS FOR PROTECTING INVESTORS FROM THE NEXT SECURITIES FRAUD,House Committee on Financial Services,Agency Conduct
2011-05-11,LEGISLATIVE PROPOSALS TO ADDRESS THE NEGATIVE CONSEQUENCES OF THE DODD-FRANK WHISTLEBLOWER PROVISIONS,House Committee on Financial Services,Legislative
2011-05-11,MONETARY POLICY AND THE DEBT CEILING: EXAMINING THE RELATIONSHIP BETWEEN THE FEDERAL RESERVE AND GOVERNMENT DEBT,House Committee on Financial Services,Fact Finding
2011-04-14,OVERSIGHT OF THE FINANCIAL STABILITY OVERSIGHT COUNCIL,House Committee on Financial Services,Agency Conduct
2011-04-14,UNDERSTANDING THE IMPLICATIONS AND CONSEQUENCES OF THE PROPOSED RULE ON RISK RETENTION,House Committee on Financial Services,Fact Finding
2011-04-07,"BULLION COIN PROGRAMS OF THE UNITED STATES MINT: CAN
THEY BE IMPROVED?",House Committee on Financial Services,Fact Finding
2011-04-06,LEGISLATIVE PROPOSALS TO IMPROVE THE STRUCTURE OF THE CONSUMER FINANCIAL PROTECTION BUREAU,House Committee on Financial Services,Legislative
2011-03-31,LEGISLATIVE HEARING ON IMMEDIATE STEPS TO PROTECT TAXPAYERS FROM THE ONGOING BAILOUT OF FANNIE MAE AND FREDDIE MAC,House Committee on Financial Services,Legislative
2011-03-30,THE COSTS OF IMPLEMENTING THE DODD-FRANK ACT: BUDGETARY AND ECONOMIC,House Committee on Financial Services,Policy
2011-03-17,THE RELATIONSHIP OF MONETARY POLICY AND RISING PRICES,House Committee on Financial Services,Fact Finding
2011-03-16,"LEGISLATIVE PROPOSALS TO PROMOTE JOB CREATION, CAPITAL FORMATION, AND MARKET CERTAINTY",House Committee on Financial Services,Legislative
2011-03-16,OVERSIGHT OF THE CONSUMER FINANCIAL PROTECTION BUREAU,House Committee on Financial Services,Policy
2011-03-11,LEGISLATIVE PROPOSALS TO CREATE A COVERED BOND MARKET IN THE UNITED STATES,House Committee on Financial Services,Legislative
2011-03-10,"OVERSIGHT OF THE U.S. SECURITIES AND EXCHANGE COMMISSION'S OPERATIONS, ACTIVITIES, CHALLENGES, AND FY 2012 BUDGET REQUEST",House Committee on Financial Services,Legislative
2011-03-10,THE ROLE OF THE EXPORT-IMPORT BANK IN U.S. COMPETITIVENESS AND JOB CREATION,House Committee on Financial Services,Fact Finding
2011-03-02,MONETARY POLICY AND THE STATE OF THE ECONOMY,House Committee on Financial Services,Policy
2011-03-02,THE EFFECT OF DODD-FRANK ON SMALL FINANCIAL INSTITUTIONS AND SMALL BUSINESSES,House Committee on Financial Services,Fact Finding
2011-03-01,MORTGAGE FINANCE REFORM: AN EXAMINATION OF THE OBAMA ADMINISTRATION'S REPORT TO CONGRESS,House Committee on Financial Services,Policy
2011-03-01,OVERSIGHT OF THE DEPARTMENT OF HOUSING AND URBAN DEVELOPMENT (HUD),House Committee on Financial Services,Policy
2011-02-17,UNDERSTANDING THE FEDERAL RESERVE'S PROPOSED RULE ON INTERCHANGE FEES: IMPLICATIONS AND CONSEQUENCES OF THE DURBIN AMENDMENT,House Committee on Financial Services,Legislative
2011-02-16,THE FINAL REPORT OF THE FINANCIAL CRISIS INQUIRY COMMISSION,House Committee on Financial Services,Policy
2011-02-15,AN ANALYSIS OF THE POST-CONSERVATORSHIP LEGAL EXPENSES OF FANNIE MAE AND FREDDIE MAC,House Committee on Financial Services,Policy
2011-02-15,"ASSESSING THE REGULATORY, ECONOMIC, AND MARKET IMPLICATIONS OF THE DODD-FRANK DERIVATIVES TITLE",House Committee on Financial Services,Policy
2011-02-09,CAN MONETARY POLICY REALLY CREATE JOBS?,House Committee on Financial Services,Fact Finding
2011-02-09,GSE REFORM: IMMEDIATE STEPS TO PROTECT TAXPAYERS AND END THE BAILOUT,House Committee on Financial Services,Legislative
2011-01-26,PROMOTING ECONOMIC RECOVERY AND JOB CREATION: THE ROAD FORWARD,House Committee on Financial Services,Fact Finding
2010-12-08,A PROPOSAL TO INCREASE THE OFFERING LIMIT UNDER SEC REGULATION A,House Committee on Financial Services,Policy
2010-11-30,INVESTMENTS TIED TO GENOCIDE: SUDAN DIVESTMENT AND BEYOND,House Committee on Financial Services,Policy
2010-11-18,"ROBO-SIGNING, CHAIN OF TITLE, LOSS MITIGATION, AND OTHER ISSUES IN MORTGAGE SERVICING",House Committee on Financial Services,Agency Conduct
2010-11-16,THE GLOBAL FINANCIAL CRISIS AND FINANCIAL REFORMS IN NIGERIA,House Committee on Financial Services,Fact Finding
2010-09-29,EX-IM BANK OVERSIGHT: THE ROLE OF TRADE FINANCE IN DOUBLING EXPORTS OVER FIVE YEARS,House Committee on Financial Services,Policy
2010-09-29,THE FUTURE OF HOUSING FINANCE--A REVIEW OF PROPOSALS TO ADDRESS MARKET STRUCTURE AND TRANSITION,House Committee on Financial Services,Fact Finding
2010-09-29,THE INCLUSIVE HOME DESIGN ACT,House Committee on Financial Services,Policy
2010-09-28,A REVIEW OF CURRENT AND EVOLVING TRENDS IN TERRORISM FINANCING,House Committee on Financial Services,Policy
2010-09-24,EXECUTIVE COMPENSATION OVERSIGHT AFTER THE DODD-FRANK WALL STREET REFORM AND CONSUMER PROTECTION ACT,House Committee on Financial Services,Policy
2010-09-23,"LEGISLATIVE HEARING ON H.R. 3149, THE EQUAL EMPLOYMENT FOR ALL ACT",House Committee on Financial Services,Legislative
2010-09-23,PERSPECTIVES ON THE LIVABLE COMMUNITIES ACT OF 2010,House Committee on Financial Services,Legislative
2010-09-22,IMPLEMENTATION OF HIGHER FHA LOAN FEES AND PENDING LEGISLATIVE PROPOSALS TO STRENGTHEN THE FHA MMIF FUND AND IMPROVE LENDER OVERSIGHT,House Committee on Financial Services,Legislative
2010-09-22,"THE STATE OF THE INTERNATIONAL FINANCIAL SYSTEM, INCLUDING INTERNATIONAL REGULATORY ISSUES RELEVANT TO THE IMPLEMENTATION OF THE DODD-FRANK ACT",House Committee on Financial Services,Policy
2010-09-16,LEGISLATIVE PROPOSALS TO ADDRESS CONCERNS OVER THE SEC'S NEW CONFIDENTIALITY PROVISION,House Committee on Financial Services,Legislative
2010-08-24,EMPOWERING CONSUMERS: CAN FINANCIAL LITERACY EDUCATION PREVENT ANOTHER FINANCIAL CRISIS?,House Committee on Financial Services,Policy
2010-08-23,TOO BIG HAS FAILED: LEARNING FROM MIDWEST BANKS AND CREDIT UNIONS,House Committee on Financial Services,Fact Finding
2010-07-29,"ALTERNATIVES FOR PROMOTING LIQUIDITY IN THE COMMERCIAL REAL ESTATE MARKETS, SUPPORTING SMALL BUSINESSES, AND INCREASING JOB GROWTH",House Committee on Financial Services,Fact Finding
2010-07-22,"MONETARY POLICY AND THE STATE OF THE ECONOMY, PART I",House Committee on Financial Services,Policy
2010-07-21,"H.R. 2267, THE INTERNET GAMBLING REGULATION, CONSUMER PROTECTION, AND ENFORCEMENT ACT",House Committee on Financial Services,Legislative
2010-07-20,THE STATE OF U.S. COINS AND CURRENCY,House Committee on Financial Services,Fact Finding
2010-07-13,AFTER THE FINANCIAL CRISIS: ONGOING CHALLENGES FACING DELPHI RETIREES,House Committee on Financial Services,Fact Finding
2010-05-26,ANTI-MONEY LAUNDERING: BLOCKING TERRORIST FINANCING AND ITS IMPACT ON LAWFUL CHARITIES,House Committee on Financial Services,Policy
2010-05-25,THE ADMINISTRATION'S PROPOSAL TO PRESERVE AND TRANSFORM PUBLIC AND ASSISTED HOUSING: THE TRANSFORMING RENTAL ASSISTANCE INITIATIVE,House Committee on Financial Services,Policy
2010-05-20,THE ROLE OF THE INTERNATIONAL MONETARY FUND AND THE FEDERAL RESERVE IN STABILIZING EUROPE,House Committee on Financial Services,Fact Finding
2010-05-18,"INITIATIVES TO PROMOTE SMALL BUSINESS LENDING, JOBS, AND ECONOMIC GROWTH",House Committee on Financial Services,Fact Finding
2010-05-17,COMMERCIAL REAL ESTATE: A CHICAGO PERSPECTIVE ON CURRENT MARKET CHALLENGES AND POSSIBLE RESPONSES,House Committee on Financial Services,Policy
2010-05-12,MINORITIES AND WOMEN IN FINANCIAL REGULATORY REFORM: THE NEED FOR INCREASING PARTICIPATION AND OPPORTUNITIES FOR QUALIFIED PERSONS AND BUSINESSES,House Committee on Financial Services,Policy
2010-05-12,USE OF CREDIT INFORMATION BEYOND LENDING: ISSUES AND REFORM PROPOSALS,House Committee on Financial Services,Fact Finding
2010-05-11,TARP OVERSIGHT: AN UPDATE ON WARRANT REPURCHASES AND BENEFITS TO TAXPAYERS,House Committee on Financial Services,Policy
2010-05-06,THE END OF EXCESS (PART ONE): REVERSING OUR ADDICTION TO DEBT AND LEVERAGE,House Committee on Financial Services,Fact Finding
2010-04-28,LEGISLATIVE PROPOSALS TO PRESERVE PUBLIC HOUSING,House Committee on Financial Services,Legislative
2010-04-28,PROMOTING SMALL AND MICRO ENTERPRISE IN HAITI,House Committee on Financial Services,Fact Finding
2010-04-28,REVIEWING FinCEN OVERSIGHT REPORTS,House Committee on Financial Services,Policy
2010-04-21,LEGISLATIVE PROPOSALS TO REFORM THE NATIONAL FLOOD INSURANCE PROGRAM,House Committee on Financial Services,Legislative
2010-04-20,PUBLIC POLICY ISSUES RAISED BY THE REPORT OF THE LEHMAN BANKRUPTCY EXAMINER,House Committee on Financial Services,Fact Finding
2010-04-15,PERSPECTIVES AND PROPOSALS ON THE COMMUNITY REINVESTMENT ACT,House Committee on Financial Services,Legislative
2010-04-14,HOUSING FINANCE--WHAT SHOULD THE PERSPECTIVES AND PROPOSALS ON THE COMMUNITY REINVESTMENT ACT,House Committee on Financial Services,Fact Finding
2010-04-14,THE RECENTLY ANNOUNCED REVISIONS TO THE HOME AFFORDABLE MODIFICATION PROGRAM (HAMP),House Committee on Financial Services,Fact Finding
2010-04-13,SECOND LIENS AND OTHER BARRIERS TO PRINCIPAL REDUCTION AS AN EFFECTIVE FORECLOSURE MITIGATION PROGRAM,House Committee on Financial Services,Policy
2010-04-10,ADDRESSING THE HOUSING NEEDS OF NATIVE AMERICAN VETERANS WITH DISABILITIES,House Committee on Financial Services,Fact Finding
2010-03-25,UNWINDING EMERGENCY FEDERAL RESERVE LIQUIDITY PROGRAMS AND IMPLICATIONS FOR ECONOMIC RECOVERY,House Committee on Financial Services,Policy
2010-03-24,"H.R. 4868, THE HOUSING PRESERVATION AND TENANT PROTECTION ACT OF 2010",House Committee on Financial Services,Legislative
2010-03-24,"KEEPING SCORE ON CREDIT SCORES: AN OVERVIEW OF CREDIT SCORES, CREDIT REPORTS, AND THEIR IMPACT ON CONSUMERS",House Committee on Financial Services,Policy
2010-03-23,HOUSING FINANCE,House Committee on Financial Services,Fact Finding
2010-03-17,EXAMINING THE LINK BETWEEN FED BANK SUPERVISION AND MONETARY POLICY,House Committee on Financial Services,Fact Finding
2010-03-17,THE ADMINISTRATION'S PROPOSAL TO REVITALIZE SEVERELY DISTRESSED PUBLIC AND ASSISTED HOUSING: THE CHOICE NEIGHBORHOODS INITIATIVE,House Committee on Financial Services,Policy
2010-03-16,REBUILDING HAITI'S COMPETITIVENESS AND PRIVATE SECTOR,House Committee on Financial Services,Fact Finding
2010-03-11,THE FHA REFORM ACT OF 2010,House Committee on Financial Services,Legislative
2010-03-10,"APPROACHES TO MITIGATING AND MANAGING NATURAL CATASTROPHE RISK: H.R. 2555, THE HOMEOWNERS' DEFENSE ACT",House Committee on Financial Services,Policy
2010-03-10,REGULATION OF MONEY SERVICE BUSINESSES,House Committee on Financial Services,Fact Finding
2010-03-09,"COMMUNITY DEVELOPMENT FINANCIAL INSTITUTIONS (CDFIs): THEIR UNIQUE ROLE AND CHALLENGES SERVING LOWER-INCOME, UNDERSERVED,",House Committee on Financial Services,Fact Finding
2010-03-04,HAITI DEBT RELIEF,House Committee on Financial Services,Fact Finding
2010-02-26,CONDITION OF SMALL BUSINESS AND COMMERCIAL REAL ESTATE LENDING IN LOCAL MARKETS,House Committee on Financial Services,Fact Finding
2010-02-25,COMPENSATION IN THE FINANCIAL INDUSTRY,House Committee on Financial Services,Fact Finding
2010-02-24,MONETARY POLICY AND THE STATE OF THE ECONOMY,House Committee on Financial Services,Policy
2010-02-23,PROSPECTS FOR EMPLOYMENT GROWTH: IS ADDITIONAL STIMULUS NEEDED?,House Committee on Financial Services,Policy
2010-01-27,THE STATE OF GLOBAL MICROFINANCE: HOW PUBLIC AND PRIVATE FUNDS CAN EFFECTIVELY PROMOTE FINANCIAL INCLUSION FOR ALL,House Committee on Financial Services,Policy
2010-01-23,THE IMPACT OF THE FORECLOSURE CRISIS ON PUBLIC AND AFFORDABLE HOUSING IN THE TWIN CITIES,House Committee on Financial Services,Postponed
2010-01-22,COMPENSATION IN THE FINANCIAL INDUSTRY,House Committee on Financial Services,Fact Finding
2010-01-21,THE CONDITION OF FINANCIAL INSTITUTIONS: EXAMINING THE FAILURE AND SEIZURE OF AN AMERICAN BANK,House Committee on Financial Services,Fact Finding
2010-01-20,"H.R. 476, THE HOUSING FAIRNESS ACT OF 2009",House Committee on Financial Services,Legislative
2009-12-15,COVERED BONDS: PROSPECTS FOR A U.S. MARKET GOING FORWARD,House Committee on Financial Services,Policy
2009-12-08,THE PRIVATE SECTOR AND GOVERNMENT RESPONSE TO THE MORTGAGE FORECLOSURE CRISIS,House Committee on Financial Services,Policy
2009-12-03,"H.R. 2266, THE REASONABLE PRUDENCE IN REGULATION ACT; AND H.R. 2267, THE INTERNET GAMBLING REGULATION, CONSUMER PROTECTION, AND ENFORCEMENT ACT",House Committee on Financial Services,Legislative
2009-12-02,FY09 FHA ACTUARIAL REPORT,House Committee on Financial Services,Policy
2009-11-30,IMPROVING RESPONSIBLE LENDING TO SMALL BUSINESSES,House Committee on Financial Services,Fact Finding
2009-10-30,THE OVERDRAFT PROTECTION ACT OF 2009,House Committee on Financial Services,Legislative
2009-10-29,"SYSTEMIC REGULATION, PRUDENTIAL MATTERS, RESOLUTION AUTHORITY, AND SECURITIZATION",House Committee on Financial Services,Fact Finding
2009-10-08,"H.R. 2382, THE CREDIT CARD INTERCHANGE FEES ACT OF 2009; AND H.R. 3639, THE EXPEDITED CARD REFORM FOR CONSUMERS ACT OF 2009",House Committee on Financial Services,Legislative
2009-10-08,"THE FUTURE OF THE FEDERAL HOUSING ADMINISTRATION'S CAPITAL RESERVES: ASSUMPTIONS, PREDICTIONS, AND IMPLICATIONS FOR HOMEBUYERS",House Committee on Financial Services,Policy
2009-10-07,REFORM OF THE OVER-THE-COUNTER DERIVATIVE MARKET: LIMITING RISK AND ENSURING FAIRNESS,House Committee on Financial Services,Fact Finding
2009-10-06,"CAPITAL MARKETS REGULATORY REFORM: STRENGTHENING INVESTOR PROTECTION, ENHANCING OVERSIGHT OF PRIVATE POOLS OF CAPITAL, AND CREATING A NATIONAL INSURANCE OFFICE",House Committee on Financial Services,Policy
2009-10-01,FEDERAL RESERVE PERSPECTIVES ON FINANCIAL REGULATORY REFORM PROPOSALS,House Committee on Financial Services,Fact Finding
2009-09-30,PERSPECTIVES ON THE CONSUMER FINANCIAL PROTECTION AGENCY,House Committee on Financial Services,Fact Finding
2009-09-25,"H.R. 1207, THE FEDERAL RESERVE TRANSPARENCY ACT OF 2009",House Committee on Financial Services,Legislative
2009-09-24,EXPERTS' PERSPECTIVES ON SYSTEMIC RISK AND RESOLUTION ISSUES,House Committee on Financial Services,Fact Finding
2009-09-23,FEDERAL REGULATOR PERSPECTIVES ON FINANCIAL REGULATORY REFORM PROPOSALS,House Committee on Financial Services,Fact Finding
2009-09-23,THE ADMINISTRATION'S PROPOSALS FOR FINANCIAL REGULATORY REFORM,House Committee on Financial Services,Legislative
2009-09-17,UTILIZING TECHNOLOGY TO IMPROVE TARP AND FINANCIAL OVERSIGHT,House Committee on Financial Services,Policy
2009-09-16,PROPOSALS TO ENHANCE THE COMMUNITY REINVESTMENT ACT,House Committee on Financial Services,Legislative
2009-09-10,THE WORLD BANK'S DISCLOSURE POLICY REVIEW AND THE ROLE OF DEMOCRATIC PARTICIPATORY PROCESSES IN ACHIEVING SUCCESSFUL DEVELOPMENT OUTCOMES,House Committee on Financial Services,Fact Finding
2009-09-09,PROGRESS OF THE MAKING HOME AFFORDABLE PROGRAM: WHAT ARE THE OUTCOMES FOR HOMEOWNERS AND WHAT ARE THE OBSTACLES TO SUCCESS?,House Committee on Financial Services,Fact Finding
2009-08-21,STATUS OF THE ``BIG FOUR'' FOUR YEARS AFTER HURRICANE KATRINA,House Committee on Financial Services,Policy
2009-08-20,IMPLEMENTATION OF THE ROAD HOME PROGRAM FOUR YEARS AFTER HURRICANE KATRINA,House Committee on Financial Services,Policy
2009-07-29,ACADEMIC PERSPECTIVES ON THE FUTURE OF PUBLIC HOUSING,House Committee on Financial Services,Fact Finding
2009-07-24,"REGULATORY PERSPECTIVES ON THE OBAMA ADMINISTRATION'S FINANCIAL REGULATORY REFORM PROPOSALS, PART II",House Committee on Financial Services,Policy
2009-07-22,"REGULATORY PERSPECTIVES ON THE OBAMA ADMINISTRATION'S FINANCIAL REGULATORY REFORM PROPOSALS, PART I",House Committee on Financial Services,Policy
2009-07-22,TARP OVERSIGHT: WARRANT REPURCHASES AND PROTECTING TAXPAYERS,House Committee on Financial Services,Policy
2009-07-21,MONETARY POLICY AND THE STATE OF THE ECONOMY,House Committee on Financial Services,Policy
2009-07-21,"SYSTEMIC RISK: ARE SOME INSTITUTIONS TOO BIG TO FAIL AND IF SO, WHAT SHOULD WE DO ABOUT IT?",House Committee on Financial Services,Fact Finding
2009-07-20,LEGISLATIVE PROPOSALS TO INCREASE WORK AND HEALTH CARE OPPORTUNITIES FOR PUBLIC AND SUBSIDIZED HOUSING RESIDENTS,House Committee on Financial Services,Legislative
2009-07-17,INDUSTRY PERSPECTIVES ON THE OBAMA ADMINISTRATION'S FINANCIAL REGULATORY REFORM PROPOSALS,House Committee on Financial Services,Policy
2009-07-16,COMMUNITY AND CONSUMER ADVOCATES' PERSPECTIVES ON THE OBAMA ADMINISTRATION'S FINANCIAL REGULATORY REFORM PROPOSALS,House Committee on Financial Services,Policy
2009-07-16,REGULATORY RESTRUCTURING: SAFEGUARDING CONSUMER PROTECTION AND THE ROLE OF THE FEDERAL RESERVE,House Committee on Financial Services,Fact Finding
2009-07-15,BANKING INDUSTRY PERSPECTIVES ON THE OBAMA ADMINISTRATION'S FINANCIAL REGULATORY REFORM PROPOSALS,House Committee on Financial Services,Policy
2009-07-15,"LEGISLATIVE OPTIONS FOR PRESERVING FEDERALLY- AND STATE-ASSISTED AFFORDABLE HOUSING AND PREVENTING DISPLACEMENT OF LOW-INCOME, ELDERLY, AND DISABLED TENANTS",House Committee on Financial Services,Policy
2009-07-13,PREVENTING UNFAIR TRADING BY GOVERNMENT OFFICIALS,House Committee on Financial Services,Agency Conduct
2009-07-10,HEARING TO EXAMINE THE REGULATION OF OVER-THE-COUNTER DERIVATIVES,House Committee on Financial Services,Fact Finding
2009-07-09,"H.R. 3068, TARP FOR MAIN STREET ACT OF 2009",House Committee on Financial Services,Legislative
2009-07-09,REGULATORY RESTRUCTURING: BALANCING THE INDEPENDENCE OF THE FEDERAL RESERVE IN MONETARY POLICY WITH SYSTEMIC RISK REGULATION,House Committee on Financial Services,Fact Finding
2009-07-02,"THE HOMEOWNERS' INSURANCE CRISIS: SOLUTIONS FOR HOMEOWNERS, COMMUNITIES, AND TAXPAYERS",House Committee on Financial Services,Agency Conduct
2009-06-25,IMPROVING CONSUMER FINANCIAL LITERACY UNDER THE NEW REGULATORY SYSTEM,House Committee on Financial Services,Policy
2009-06-25,"LEGISLATIVE OPTIONS FOR PRESERVING FEDERALLY- AND STATE-ASSISTED AFFORDABLE HOUSING AND PREVENTING DISPLACEMENT OF LOW-INCOME, ELDERLY, AND DISABLED TENANTS",House Committee on Financial Services,Policy
2009-06-24,REGULATORY RESTRUCTURING: ENHANCING CONSUMER FINANCIAL PRODUCTS REGULATION,House Committee on Financial Services,Fact Finding
2009-06-19,THE ECONOMIC DISASTER AREA ACT OF 2009,House Committee on Financial Services,Legislative
2009-06-18,STRENGTHENING OVERSIGHT AND PREVENTING FRAUD IN FHA AND OTHER HUD PROGRAMS,House Committee on Financial Services,Policy
2009-06-16,"H.R. 2336, THE GREEN ACT OF 2009, PART II",House Committee on Financial Services,Legislative
2009-06-11,COMPENSATION STRUCTURE AND SYSTEMIC RISK,House Committee on Financial Services,Fact Finding
2009-06-11,"H.R. 2336, THE GREEN ACT OF 2009, PART I",House Committee on Financial Services,Legislative
2009-06-04,THE SECTION 8 VOUCHER REFORM ACT,House Committee on Financial Services,Legislative
2009-06-03,REMITTANCES: REGULATION AND DISCLOSURE IN A NEW ECONOMIC ENVIRONMENT,House Committee on Financial Services,Fact Finding
2009-05-21,LEGISLATIVE PROPOSALS TO IMPROVE THE EFFICIENCY AND OVERSIGHT OF MUNICIPAL FINANCE,House Committee on Financial Services,Legislative
2009-05-21,THE SECTION 8 VOUCHER REFORM ACT,House Committee on Financial Services,Legislative
2009-05-20,"H.R. 2351, THE CREDIT UNION SHARE INSURANCE STABILIZATION ACT",House Committee on Financial Services,Legislative
2009-05-19,"CAPITAL LOSS, CORRUPTION, AND THE ROLE OF WESTERN FINANCIAL INSTITUTIONS",House Committee on Financial Services,Fact Finding
2009-05-13,IMPLICATIONS OF THE G-20 LEADERS SUMMIT FOR LOW-INCOME COUNTRIES AND THE GLOBAL ECONOMY,House Committee on Financial Services,Fact Finding
2009-05-13,THE ROLE OF NEIGHBORWORKS AND HOUSING COUNSELING INTERMEDIARIES IN PREVENTING FORECLOSURES,House Committee on Financial Services,Policy
2009-05-06,LEGISLATIVE SOLUTIONS FOR PREVENTING LOAN MODIFICATION AND FORECLOSURE RESCUE FRAUD,House Committee on Financial Services,Legislative
2009-05-05,THE EFFECT OF THE LEHMAN BROTHERS BANKRUPTCY ON STATE AND LOCAL GOVERNMENTS,House Committee on Financial Services,Fact Finding
2009-05-05,"THE ROLE OF INSPECTORS GENERAL: MINIMIZING AND MITIGATING WASTE, FRAUD, AND ABUSE",House Committee on Financial Services,Agency Conduct
2009-04-23,"H.R. 1728, THE MORTGAGE REFORM AND ANTI-PREDATORY LENDING ACT OF 2009",House Committee on Financial Services,Legislative
