DATE,NAME,COMMITTEE,CATEGORY
2011-09-08,AMERICAN SPECIALTY AGRICULTURE ACT,House Committee on Judiciary,Legislative
2011-09-08,CHAPTER 11 BANKRUPTCY VENUE REFORM ACT OF 2011,House Committee on Judiciary,Legislative
2011-07-27,CHAPTER 7 BANKRUPTCY TRUSTEES' RESPONSIBILITIES AND REMUNERATION,House Committee on Judiciary,Fact Finding
2011-07-26,CLEAN-UP GOVERNMENT ACT OF 2011,House Committee on Judiciary,Policy
2011-07-26,HINDER THE ADMINISTRATION'S LEGALIZATION TEMPTATION (HALT) ACT,House Committee on Judiciary,Legislative
2011-07-12,PROTECTING CHILDREN FROM INTERNET PORNOGRAPHERS ACT OF 2011,House Committee on Judiciary,Legislative
2011-07-11,ROLE OF SOCIAL SECURITY ADMINISTRATIVE LAW JUDGES,House Committee on Judiciary,Fact Finding
2011-06-15,LEGAL WORKFORCE ACT,House Committee on Judiciary,Legislative
2011-06-14,FOREIGN CORRUPT PRACTICES ACT,House Committee on Judiciary,Legislative
2011-05-31,FORMAL RULEMAKING AND JUDICIAL REVIEW: PROTECTING JOBS AND THE ECONOMY WITH GREATER REGULATORY TRANSPARENCY AND ACCOUNTABILITY,House Committee on Judiciary,Agency Conduct
2011-05-25,MOBILE WORKFORCE STATE INCOME TAX SIMPLIFICATION ACT OF 2011,House Committee on Judiciary,Legislative
2011-05-24,KEEP OUR COMMUNITIES SAFE ACT,House Committee on Judiciary,Legislative
2011-05-23,DIGITAL GOODS AND SERVICES TAX FAIRNESS ACT OF 2011,House Committee on Judiciary,Legislative
2011-05-11,SECURE VISAS ACT,House Committee on Judiciary,Legislative
2011-05-11,USA PATRIOT ACT: DISPELLING THE MYTHS,House Committee on Judiciary,Legislative
2011-05-04,COST-JUSTIFYING REGULATIONS: PROTECTING JOBS AND THE ECONOMY BY PRESIDENTIAL AND JUDICIAL REVIEW OF COSTS AND BENEFITS,House Committee on Judiciary,Fact Finding
2011-05-03,UNITED STATES DEPARTMENT OF JUSTICE,House Committee on Judiciary,Fact Finding
2011-04-13,H-2A VISA PROGRAM: MEETING THE GROWING NEEDS OF AMERICAN AGRICULTURE?,House Committee on Judiciary,Fact Finding
2011-04-05,JUSTICE FOR AMERICA: USING MILITARY COMMISSIONS TO TRY THE 9/11 CONSPIRATORS,House Committee on Judiciary,Fact Finding
2011-04-05,SAFE FOR AMERICA ACT,House Committee on Judiciary,Legislative
2011-03-31,H-1B VISAS: DESIGNING A PROGRAM TO MEET THE NEEDS OF THE U.S. ECONOMY AND U.S. WORKERS,House Committee on Judiciary,Fact Finding
2011-03-30,PERMANENT PROVISIONS OF THE PATRIOT ACT,House Committee on Judiciary,Legislative
2011-03-29,RAISING THE AGENCIES' GRADES,House Committee on Judiciary,Fact Finding
2011-03-16,FEDERAL BUREAU OF INVESTIGATION,House Committee on Judiciary,Fact Finding
2011-03-15,WIRELESS TAX FAIRNESS ACT OF 2011,House Committee on Judiciary,Legislative
2011-03-10,NEW JOBS IN RECESSION AND RECOVERY: WHO ARE GETTING THEM AND WHO ARE NOT,House Committee on Judiciary,Policy
2011-03-09,REAUTHORIZATION OF THE PATRIOT ACT,House Committee on Judiciary,Legislative
2011-03-08,REGULATIONS FROM THE EXECUTIVE IN NEED OF SCRUTINY ACT OF 2011,House Committee on Judiciary,Legislative
2011-03-01,MAKING IMMIGRATION WORK FOR AMERICAN MINORITIES,House Committee on Judiciary,Fact Finding
2011-02-28,"APA AT 65: IS REFORM NEEDED TO CREATE JOBS, PROMOTE ECONOMIC GROWTH, AND REDUCE COSTS?",House Committee on Judiciary,Fact Finding
2011-02-17,GOING DARK: LAWFUL ELECTRONIC SURVEILLANCE IN THE FACE OF NEW TECHNOLOGIES,House Committee on Judiciary,Fact Finding
2011-02-16,CONSTITUTIONALITY OF THE INDIVIDUAL MANDATE,House Committee on Judiciary,Fact Finding
2011-02-15,REAUTHORIZATION OF THE ADAM WALSH ACT,House Committee on Judiciary,Legislative
2011-02-14,ROLE OF PUBLIC EMPLOYEE PENSIONS IN CONTRIBUTING TO STATE INSOLVENCY AND THE POSSIBILITY OF A STATE BANKRUPTCY CHAPTER,House Committee on Judiciary,Fact Finding
2011-02-10,``REGULATORY FLEXIBILITY IMPROVEMENTS ACT OF 2011''--UNLEASHING SMALL BUSINESSES TO CREATE JOBS,House Committee on Judiciary,Legislative
2011-02-10,E-VERIFY: PRESERVING JOBS FOR AMERICAN WORKERS,House Committee on Judiciary,Fact Finding
2011-01-26,ICE WORKSITE ENFORCEMENT,House Committee on Judiciary,Fact Finding
2011-01-25,DATA RETENTION AS A TOOL FOR INVESTIGATING INTERNET CHILD PORNOGRAPHY AND OTHER INTERNET CRIMES,House Committee on Judiciary,Policy
2011-01-24,REINS ACT--PROMOTING JOBS AND EXPANDING FREEDOM BY REDUCING NEEDLESS REGULATIONS,House Committee on Judiciary,Legislative
2011-01-20,"MEDICAL LIABILITY REFORM: CUTTING COSTS, SPURRING INVESTMENT, CREATING JOBS",House Committee on Judiciary,Fact Finding
2010-12-16,ESPIONAGE ACT AND THE LEGAL AND CONSTITUTIONAL ISSUES RAISED BY WIKILEAKS,House Committee on Judiciary,Fact Finding
2010-12-02,FORECLOSED JUSTICE: CAUSES AND EFFECTS OF THE FORECLOSURE CRISIS (PART I & II),House Committee on Judiciary,Fact Finding
2010-12-01,"ANTITRUST LAWS AND THEIR EFFECTS ON HEALTHCARE PROVIDERS, INSURERS AND PATIENTS",House Committee on Judiciary,Fact Finding
2010-09-30,ROLE OF IMMIGRATION IN STRENGTHENING AMERICA'S ECONOMY,House Committee on Judiciary,Fact Finding
2010-09-29,COMPREHENSIVE ALCOHOL REGULATORY EFFECTIVENESS (CARE) ACT OF 2010,House Committee on Judiciary,Legislative
2010-09-29,"COURTROOM USE: ACCESS TO JUSTICE, EFFECTIVE JUDICIAL ADMINISTRATION, AND COURTROOM SECURITY",House Committee on Judiciary,Fact Finding
2010-09-29,REAUTHORIZATION OF THE SECOND CHANCE ACT,House Committee on Judiciary,Legislative
2010-09-28,"REINING IN OVERCRIMINALIZATION: ASSESSING THE PROBLEM, PROPOSING SOLUTIONS",House Committee on Judiciary,Fact Finding
2010-09-24,[ERRATA] PROTECTING AMERICA'S HARVEST,House Committee on Judiciary,Fact Finding
2010-09-24,PROTECTING AMERICA'S HARVEST,House Committee on Judiciary,Fact Finding
2010-09-22,HOLOCAUST INSURANCE ACCOUNTABILITY ACT OF 2010,House Committee on Judiciary,Legislative
2010-09-16,COMPETITION IN THE EVOLVING DIGITAL MARKETPLACE,House Committee on Judiciary,Fact Finding
2010-09-15,DOMESTIC MINOR SEX TRAFFICKING,House Committee on Judiciary,Fact Finding
2010-07-28,"ONLINE PRIVACY, SOCIAL NETWORKING, AND CRIME VICTIMIZATION",House Committee on Judiciary,Policy
2010-07-27,FEDERAL RULEMAKING AND THE REGULATORY PROCESS,House Committee on Judiciary,Policy
2010-07-27,FEDERAL TRADE COMMISSION'S BUREAU OF COMPETITION AND THE U.S. DEPARTMENT OF JUSTICE'S ANTITRUST DIVISION,House Committee on Judiciary,Policy
2010-07-21,ENSURING JUSTICE FOR VICTIMS OF THE GULF COAST OIL DISASTER,House Committee on Judiciary,Private Sector Oversight
2010-07-15,MEDICAL BANKRUPTCY FAIRNESS ACT,House Committee on Judiciary,Legislative
2010-07-14,ETHICAL IMPERATIVE FOR REFORM OF OUR IMMIGRATION SYSTEM,House Committee on Judiciary,Fact Finding
2010-07-13,IMPACT OF CHINA'S ANTITRUST LAW AND OTHER COMPETITION POLICIES ON U.S. COMPANIES,House Committee on Judiciary,Fact Finding
2010-06-29,ROLE AND OPERATIONS OF THE UNITED STATES SECRET SERVICE,House Committee on Judiciary,Fact Finding
2010-06-24,CIVIL DIVISION OF THE UNITED STATES DEPARTMENT OF JUSTICE,House Committee on Judiciary,Policy
2010-06-17,EXECUTIVE OFFICE FOR IMMIGRATION REVIEW,House Committee on Judiciary,Fact Finding
2010-06-16,COMPETITION IN THE AIRLINE INDUSTRY,House Committee on Judiciary,Fact Finding
2010-06-15,END DISCRIMINATORY STATE TAXES FOR AUTOMOBILE RENTERS ACT OF 2009,House Committee on Judiciary,Legislative
2010-06-15,IS THERE LIFE AFTER TRINKO AND CREDIT SUISSE?: THE ROLE OF ANTITRUST IN REGULATED INDUSTRIES,House Committee on Judiciary,Fact Finding
2010-06-09,COLLATERAL CONSEQUENCES OF CRIMINAL CONVICTIONS: BARRIERS TO REENTRY FOR THE FORMERLY INCARCERATED,House Committee on Judiciary,Fact Finding
2010-06-07,PROPOSED COMBINATION OF COMCAST AND NBC-UNIVERSAL,House Committee on Judiciary,Fact Finding
2010-05-27,LEGAL LIABILITY ISSUES SURROUNDING THE GULF COAST OIL DISASTER,House Committee on Judiciary,Private Sector Oversight
2010-05-26,UNITED STATES v. STEVENS: THE SUPREME COURT'S DECISION INVALIDATING THE CRUSH VIDEO STATUTE,House Committee on Judiciary,Fact Finding
2010-05-25,PROTECTING EMPLOYEES AND RETIREES IN BUSINESS BANKRUPTCIES ACT OF 2010,House Committee on Judiciary,Legislative
2010-05-25,REMOVAL CLARIFICATION ACT OF 2010,House Committee on Judiciary,Legislative
2010-05-25,SENIOR FINANCIAL EMPOWERMENT ACT OF 2009,House Committee on Judiciary,Legislative
2010-05-20,ADMINISTRATIVE CONFERENCE OF THE UNITED STATES,House Committee on Judiciary,Legislative
2010-05-20,RAPE KIT BACKLOGS: FAILING THE TEST OF PROVIDING JUSTICE TO SEXUAL ASSAULT SURVIVORS,House Committee on Judiciary,Fact Finding
2010-05-13,UNITED STATES DEPARTMENT OF JUSTICE,House Committee on Judiciary,Fact Finding
2010-05-11,"CRIMINAL JUSTICE REINVESTMENT ACT OF 2009, AND THE HONEST OPPORTUNITY PROBATION WITH ENFORCEMENT (HOPE) INITIATIVE ACT OF 2009",House Committee on Judiciary,Legislative
2010-05-06,STATE TAXATION: THE ROLE OF CONGRESS IN DEVELOPING APPORTIONMENT STANDARDS,House Committee on Judiciary,Policy
2010-05-05,UNITED STATES PATENT AND TRADEMARK OFFICE,House Committee on Judiciary,Fact Finding
2010-04-28,CREDIT CARD FAIR FEE ACT OF 2009,House Committee on Judiciary,Legislative
2010-04-27,CIVIL ACCESS TO JUSTICE ACT OF 2009,House Committee on Judiciary,Legislative
2010-04-22,PRIVATE STUDENT LOAN BANKRUPTCY FAIRNESS ACT OF 2010,House Committee on Judiciary,Legislative
2010-04-15,STATE TAXATION: THE IMPACT OF CONGRESSIONAL LEGISLATION ON STATE AND LOCAL GOVERNMENT REVENUES,House Committee on Judiciary,Field
2010-03-24,SHARING AND ANALYZING INFORMATION TO PREVENT TERRORISM,House Committee on Judiciary,Fact Finding
2010-03-23,UNITED STATES CITIZENSHIP AND IMMIGRATION SERVICES,House Committee on Judiciary,Fact Finding
2010-03-22,DESIGN PATENTS AND AUTO REPLACEMENT PARTS,House Committee on Judiciary,Fact Finding
2010-03-18,LEGAL ISSUES CONCERNING STATE ALCOHOL REGULATION,House Committee on Judiciary,Policy
2010-03-04,ENFORCEMENT OF THE CRIMINAL LAWS AGAINST MEDICARE AND MEDICAID FRAUD,House Committee on Judiciary,Policy
2010-03-03,DOMESTIC AND INTERNATIONAL TRADEMARK IMPLICATIONS OF HAVANA CLUB AND SECTION 211 OF THE OMNIBUS APPROPRIATIONS ACT OF 1999,House Committee on Judiciary,Legislative
2010-02-25,COMPETITION IN THE MEDIA AND ENTERTAINMENT DISTRIBUTION MARKET,House Committee on Judiciary,Fact Finding
2010-02-23,KEEPING YOUTH SAFE WHILE IN CUSTODY: SEXUAL ASSAULT IN ADULT AND JUVENILE FACILITIES,House Committee on Judiciary,Fact Finding
2010-02-04,STATE TAXATION: THE ROLE OF CONGRESS IN DEFINING NEXUS,House Committee on Judiciary,Fact Finding
2010-01-21,HELP FIND THE MISSING ACT OR BILLY'S LAW,House Committee on Judiciary,Legislative
2010-01-20,ANTITRUST IMPLICATIONS OF AMERICAN NEEDLE v. NFL,House Committee on Judiciary,Fact Finding
2009-12-16,OPEN ACCESS TO COURTS ACT OF 2009,House Committee on Judiciary,Legislative
2009-12-16,PIRACY OF LIVE SPORTS BROADCASTING OVER THE INTERNET,House Committee on Judiciary,Fact Finding
2009-12-16,PROTECTING EMPLOYEES IN AIRLINE BANKRUPTCIES,House Committee on Judiciary,Legislative
2009-12-15,"TO CONSIDER POSSIBLE IMPEACHMENT OF UNITED STATES DISTRICT JUDGE G. THOMAS PORTEOUS, JR. (PART IV)",House Committee on Judiciary,Legislative
2009-12-11,HOME FORECLOSURES: WILL VOLUNTARY MORTGAGE MODIFICATION HELP FAMILIES SAVE THEIR HOMES? (PART II),House Committee on Judiciary,Fact Finding
2009-12-10,EXAMINING THE STATE OF JUDICIAL RECUSALS AFTER CAPERTON v. A.T. MASSEY,House Committee on Judiciary,Fact Finding
2009-12-10,"TO CONSIDER POSSIBLE IMPEACHMENT OF UNITED STATES DISTRICT JUDGE G. THOMAS PORTEOUS, JR. (PART III)",House Committee on Judiciary,Legislative
2009-12-10,TRIBAL LAW AND ORDER ACT OF 2009,House Committee on Judiciary,Legislative
2009-12-08,"TO CONSIDER POSSIBLE IMPEACHMENT OF UNITED STATES DISTRICT JUDGE G. THOMAS PORTEOUS, JR. (PART II)",House Committee on Judiciary,Legislative
2009-11-19,TRANSPARENCY AND INTEGRITY IN CORPORATE MONITORING,House Committee on Judiciary,Legislative
2009-11-17,"TO CONSIDER POSSIBLE IMPEACHMENT OF UNITED STATES DISTRICT JUDGE G. THOMAS PORTEOUS, JR. (PART I)",House Committee on Judiciary,Legislative
2009-11-17,TOO BIG TO FAIL: THE ROLE FOR BANKRUPTCY AND ANTITRUST LAW IN FINANCIAL REGULATION REFORM (PART II),House Committee on Judiciary,Fact Finding
2009-11-06,"TO AMEND TITLE 18, UNITED STATES CODE, TO INCLUDE CONSTRICTOR SNAKES OF THE SPECIES PYTHON GENERA AS AN INJURIOUS ANIMAL",House Committee on Judiciary,Field
2009-11-05,COMBATING ORGANIZED RETAIL CRIME,House Committee on Judiciary,Fact Finding
2009-10-29,RACIAL DISPARITIES IN THE CRIMINAL JUSTICE SYSTEM,House Committee on Judiciary,Fact Finding
2009-10-27,LEGAL SERVICES CORPORATION,House Committee on Judiciary,Legislative
2009-10-22,TOO BIG TO FAIL: THE ROLE FOR BANKRUPTCY AND ANTITRUST LAW IN FINANCIAL  REGULATION REFORM (PART I),House Committee on Judiciary,Fact Finding
2009-10-20,GIRLS IN THE JUVENILE JUSTICE SYSTEM: STRATEGIES TO HELP GIRLS ACHIEVE THEIR FULL POTENTIAL,House Committee on Judiciary,Fact Finding
2009-10-08,HEALTH INSURANCE INDUSTRY ENFORCEMENT ACT OF 2009,House Committee on Judiciary,Legislative
2009-09-30,CYBERBULLYING AND OTHER ONLINE SAFETY ISSUES FOR CHILDREN,House Committee on Judiciary,Fact Finding
2009-09-29,CRIME VICTIMS RIGHTS ACT OF 2004,House Committee on Judiciary,Legislative
2009-09-23,AN UNDUE HARDSHIP? DISCHARGING EDUCATIONAL DEBT IN BANKRUPTCY,House Committee on Judiciary,Fact Finding
2009-09-23,EXPANSION OF TOP LEVEL DOMAINS AND ITS EFFECT ON COMPETITION,House Committee on Judiciary,Fact Finding
2009-09-22,REAUTHORIZATION OF THE INNOCENCE PROTECTION ACT,House Committee on Judiciary,Legislative
2009-09-15,MANDATORY BINDING ARBITRATION: IS IT FAIR AND VOLUNTARY?,House Committee on Judiciary,Fact Finding
2009-09-10,COMPETITION AND COMMERCE IN DIGITAL BOOKS,House Committee on Judiciary,Fact Finding
2009-09-09,ROLE OF THE LENDING INDUSTRY IN THE HOME FORECLOSURE CRISIS,House Committee on Judiciary,Fact Finding
2009-07-28,MEDICAL DEBT: IS OUR HEALTHCARE SYSTEM BANKRUPTING AMERICANS?,House Committee on Judiciary,Fact Finding
2009-07-27,EXECUTIVE ACCOUNTABILITY ACT OF 2009,House Committee on Judiciary,Legislative
2009-07-22,OVER-CRIMINALIZATION OF CONDUCT/ OVER-FEDERALIZATION OF CRIMINAL LAW,House Committee on Judiciary,Fact Finding
2009-07-22,RAMIFICATIONS OF AUTO INDUSTRY BANKRUPTCIES (PART III),House Committee on Judiciary,Fact Finding
2009-07-21,FEDERAL BUREAU OF PRISONS OVERSIGHT,House Committee on Judiciary,Policy
2009-07-21,RAMIFICATIONS OF AUTO INDUSTRY BANKRUPTCIES (PART II),House Committee on Judiciary,Fact Finding
2009-07-14,BIOLOGICS AND BIOSIMILARS: BALANCING INCENTIVES FOR INNOVATION,House Committee on Judiciary,Fact Finding
2009-07-14,MANDATORY MINIMUMS AND UNINTENDED CONSEQUENCES,House Committee on Judiciary,Fact Finding
2009-07-09,HOME FORECLOSURES: WILL VOLUNTARY MORTGAGE MODIFICATION HELP FAMILIES SAVE THEIR HOMES? (PART I),House Committee on Judiciary,Fact Finding
2009-07-09,TRENDS AFFECTING MINORITY BROADCAST OWNERSHIP,House Committee on Judiciary,Fact Finding
2009-07-08,NATIONAL PRISON RAPE ELIMINATION COMMISSION REPORT AND STANDARDS,House Committee on Judiciary,Policy
2009-06-25,"ACCOUNTABILITY, TRANSPARENCY, AND UNIFORMITY IN CORPORATE DEFERRED AND NON-PROSECUTION AGREEMENTS",House Committee on Judiciary,Agency Conduct
2009-06-16,BANKRUPTCY JUDGESHIP NEEDS,House Committee on Judiciary,Fact Finding
2009-06-11,EQUAL JUSTICE FOR OUR MILITARY ACT OF 2009,House Committee on Judiciary,Legislative
2009-06-09,CELL TAX FAIRNESS ACT OF 2009,House Committee on Judiciary,Legislative
2009-06-09,JUVENILE JUSTICE ACCOUNTABILITY AND IMPROVEMENT ACT OF 2009,House Committee on Judiciary,Policy
2009-06-04,INDIGENT REPRESENTATION: A GROWING NATIONAL CRISIS,House Committee on Judiciary,Legislative
2009-06-04,SUNSHINE IN LITIGATION ACT OF 2009,House Committee on Judiciary,Legislative
2009-06-03,PAY TO DELAY: ARE PATENT SETTLEMENTS THAT DELAY GENERIC DRUG MARKET ENTRY ANTICOMPETITIVE?,House Committee on Judiciary,Policy
2009-06-03,TO CONSIDER POSSIBLE IMPEACHMENT OF UNITED STATES DISTRICT JUDGE SAMUEL B. KENT OF THE SOUTHERN DISTRICT OF TEXAS,House Committee on Judiciary,Legislative
2009-05-21,RAMIFICATIONS OF AUTO INDUSTRY BANKRUPTCIES (PART I),House Committee on Judiciary,Fact Finding
2009-05-21,UNFAIRNESS IN FEDERAL COCAINE SENTENCING: IS IT TIME TO CRACK THE 100 TO 1 DISPARITY?,House Committee on Judiciary,Fact Finding
2009-05-20,FEDERAL BUREAU OF INVESTIGATION,House Committee on Judiciary,Fact Finding
2009-05-19,RAILROAD ANTITRUST ENFORCEMENT ACT OF 2009,House Committee on Judiciary,Legislative
2009-05-14,DEPARTMENT OF JUSTICE WITH ATTORNEY GENERAL ERIC HOLDER,House Committee on Judiciary,Fact Finding
2009-05-13,NATIONAL RESEARCH COUNCIL'S PUBLICATION `STRENGTHENING FORENSIC SCIENCE IN THE UNITED STATES: A PATH FORWARD',House Committee on Judiciary,Fact Finding
2009-05-06,ESCALATING VIOLENCE IN MEXICO AND THE SOUTHWEST BORDER AS A RESULT OF THE ILLICIT DRUG TRADE,House Committee on Judiciary,Field
2009-05-05,FEDERAL ARBITRATION ACT: IS THE CREDIT CARD INDUSTRY USING IT TO QUASH LEGAL CLAIMS?,House Committee on Judiciary,Fact Finding
2009-04-30,PATENT REFORM ACT OF 2009,House Committee on Judiciary,Legislative
2009-04-28,"BYE BYE BARGAINS? RETAIL PRICE FIXING, THE LEEGIN DECISION AND ITS IMPACT ON CONSUMER PRICES",House Committee on Judiciary,Fact Finding
2009-04-21,"A NEW AGE FOR NEWSPAPERS: DIVERSITY OF VOICES, COMPETITION AND THE INTERNET",House Committee on Judiciary,Fact Finding
2009-04-02,CONSUMER DEBT: ARE CREDIT CARDS BANKRUPTING AMERICANS?,House Committee on Judiciary,Fact Finding
2009-04-02,PUBLIC SAFETY AND CIVIL RIGHTS IMPLICATIONS OF STATE AND LOCAL ENFORCEMENT OF FEDERAL IMMIGRATION LAWS,House Committee on Judiciary,Policy
2009-04-01,PROPOSALS TO FIGHT FRAUD AND PROTECT TAXPAYERS,House Committee on Judiciary,Legislative
2009-03-31,JAMES ZADROGA 9/11 HEALTH AND COMPENSATION ACT OF 2009,House Committee on Judiciary,Legislative
2009-03-31,VoIP: WHO HAS JURISDICTION TO TAX IT?,House Committee on Judiciary,Policy
2009-03-26,REPRESENTATION OF INDIGENT DEFENDANTS IN CRIMINAL CASES: A CONSTITUTIONAL CRISIS IN MICHIGAN AND OTHER STATES?,House Committee on Judiciary,Field
2009-03-24,CARMELO RODRIGUEZ MILITARY MEDICAL ACCOUNTABILITY ACT OF 2009,House Committee on Judiciary,Legislative
2009-03-19,"TREATMENT OF LATIN AMERICANS OF JAPANESE DESCENT, EUROPEAN AMERICANS, AND JEWISH REFUGEES DURING WORLD WAR II",House Committee on Judiciary,Fact Finding
2009-03-17,`TOO BIG TO FAIL?': THE ROLE OF ANTITRUST LAW IN GOVERNMENT-FUNDED CONSOLIDATION IN THE BANKING INDUSTRY,House Committee on Judiciary,Fact Finding
2009-03-11,"CIRCUIT CITY UNPLUGGED: WHY DID CHAPTER 11 FAIL TO SAVE 34,000 JOBS?",House Committee on Judiciary,Fact Finding
2009-03-10,PERFORMANCE RIGHTS ACT,House Committee on Judiciary,Legislative
2009-03-10,SEX OFFENDER NOTIFICATION AND REGISTRATION ACT (SORNA): BARRIERS TO TIMELY COMPLIANCE BY STATES,House Committee on Judiciary,Legislative
2009-02-26,COMPETITION IN THE TICKETING AND PROMOTION INDUSTRY,House Committee on Judiciary,Fact Finding
2009-02-25,"COPYRIGHT LICENSING IN A DIGITAL AGE: COMPETITION, COMPENSATION AND THE NEED TO UPDATE THE CABLE AND SATELLITE TV LICENSES",House Committee on Judiciary,Fact Finding
2009-02-12,LIBEL TOURISM,House Committee on Judiciary,Policy
2009-02-11,"YOUTH VIOLENCE: TRENDS, MYTHS, AND SOLUTIONS",House Committee on Judiciary,Fact Finding
2009-02-04,MIDNIGHT RULEMAKING: SHEDDING SOME LIGHT,House Committee on Judiciary,Legislative
2009-01-22,"HELPING FAMILIES SAVE THEIR HOMES IN BANKRUPTCY ACT OF 2009, AND THE EMERGENCY HOMEOWNERSHIP AND EQUITY PROTECTION ACT",House Committee on Judiciary,Legislative
2009-01-04,LEGAL ISSUES RELATING TO FOOTBALL HEAD INJURIES (PART I & II),House Committee on Judiciary,Fact Finding
2018-09-26,"LEGISLATIVE HEARING ON H.R. 6344, TO AMEND THE ENDANGERED SPECIES ACT OF 1973 TO ENCOURAGE VOLUNTARY CONSERVATION EFFORTS, ``LOCAL ACT OF 2018''; ...... ``PETITION ACT OF 2018''",House Committee on Natural Resources,Legislative
2018-09-17,HISTORIC LEASING IN THE NATIONAL PARK SYSTEM: ASSESSING CHALLENGES AND BUILDING ON SUCCESSES,House Committee on Natural Resources,Fact Finding
2018-09-10,THE FEDERAL COLUMBIA RIVER POWER SYSTEM: THE ECONOMIC LIFEBLOOD AND WAY OF LIFE FOR THE PACIFIC NORTHWEST,House Committee on Natural Resources,Fact Finding
2018-09-05,"LEGISLATIVE HEARING ON H.R. 6583, TO AUTHORIZE THE SECRETARY OF THE INTERIOR TO CONVEY CERTAIN LANDS AND FACILITIES OF THE BIG SAND WASH PROJECT, UTAH, ``BIG SAND WASH PROJECT TITLE TRANSFER ACT''; AND H.R. 6652, TO DIRECT THE SECRETARY OF THE INTERIOR TO CONVEY CERTAIN FACILITIES, EASEMENTS, AND RIGHTS-OF-WAY TO THE KENNEWICK IRRIGATION DISTRICT, AND FOR OTHER PURPOSES",House Committee on Natural Resources,Legislative
2018-07-25,OVERSIGHT HEARING ON MANAGEMENT CRISIS AT THE PUERTO RICO ELECTRIC POWER AUTHORITY AND IMPLICATIONS FOR RECOVERY,House Committee on Natural Resources,Fact Finding
2018-03-06,OVERSIGHT HEARING ON EXPLORING INNOVATIVE SOLUTIONS TO REDUCE THE DEPARTMENT OF THE INTERIOR'S MAINTENANCE BACKLOG,House Committee on Natural Resources,Fact Finding
2017-11-29,OVERSIGHT HEARING ON MODERNIZING NEPA FOR THE 21ST CENTURY,House Committee on Natural Resources,Policy
2017-11-14,OVERSIGHT HEARING ON THE NEED FOR TRANSPARENT FINANCIAL ACCOUNTABILITY IN TERRITORIES' DISASTER RECOVERY EFFORTS,House Committee on Natural Resources,Agency Conduct
2017-11-07,EXAMINING CHALLENGES IN PUERTO RICO'S RECOVERY AND THE ROLE OF THE FINANCIAL OVERSIGHT AND MANAGEMENT BOARD,House Committee on Natural Resources,Fact Finding
2017-10-25,OVERSIGHT HEARING ON EMPOWERING STATE BASED MANAGEMENT SOLUTIONS FOR GREATER SAGE GROUSE RECOVERY,House Committee on Natural Resources,Fact Finding
2017-07-19,"H.R. 424, ``GRAY WOLF STATE MANAGEMENT ACT OF 2017''; H.R. 717, ``LISTING REFORM ACT''; H.R. 1274, ``STATE, TRIBAL, AND LOCAL SPECIES TRANSPARENCY AND RECOVERY ACT''; H.R. 2603, ``SAVING AMERICA'S ENDANGERED SPECIES ACT'' OR ``SAVES ACT''; AND H.R. 3131, ``ENDANGERED SPECIES LITIGATION REASONABLENESS ACT''",House Committee on Natural Resources,Legislative
2017-05-24,OVERSIGHT HEARING ON EXAMINING IMPACTS OF FEDERAL NATURAL RESOURCES LAWS GONE ASTRAY,House Committee on Natural Resources,Fact Finding
2017-03-28,ESA CONSULTATION IMPEDIMENTS TO ECONOMIC AND INFRASTRUCTURE DEVELOPMENT,House Committee on Natural Resources,Policy
2016-04-19,OVERSIGHT HEARING ON RECENT CHANGES TO ENDANGERED SPECIES CRITICAL HABITAT DESIGNATION AND IMPLEMENTATION,House Committee on Natural Resources,Policy
2016-04-13,"LEGISLATIVE HEARING ON DISCUSSION DRAFT, H.R., ``PUERTO RICO OVERSIGHT, MANAGEMENT, AND ECONOMIC STABILITY ACT (PROMESA)''",House Committee on Natural Resources,Legislative
2016-03-01,EXAMINING THE DEPARTMENT OF THE INTERIOR'S SPENDING PRIORITIES AND THE PRESIDENT'S FISCAL YEAR 2017 BUDGET PROPOSAL,House Committee on Natural Resources,Legislative
2016-02-25,OVERSIGHT HEARING ON THE U.S. DEPARTMENT OF THE TREASURY'S ANALYSIS OF THE SITUATION IN PUERTO RICO,House Committee on Natural Resources,Fact Finding
2015-12-14,"LEGISLATIVE FIELD HEARING ON H.R. 3734, TO AMEND THE SURFACE MINING CONTROL AND RECLAMATION ACT OF 1977 TO PROVIDE SUPPORT TO MINING SCHOOLS, AND FOR OTHER PURPOSES, ``MINING SCHOOLS ENHANCEMENT ACT''",House Committee on Natural Resources,Legislative
2015-09-17,JOINT OVERSIGHT HEARING ON EPA'S ANIMAS SPILL,House Committee on Natural Resources,Agency Conduct
2015-07-22,OVERSIGHT HEARING ON AN ANALYSIS OF THE OBAMA ADMINISTRATION'S SOCIAL COST OF CARBON,House Committee on Natural Resources,Fact Finding
2015-06-25,HOW OUR WELFARE SYSTEM CAN DISCOURAGE WORK,House Committee on Natural Resources,Fact Finding
2015-05-19,OVERSIGHT HEARING ON EMPOWERING STATE MANAGEMENT OF GREATER SAGE GROUSE,House Committee on Natural Resources,Fact Finding
2015-05-13,OVERSIGHT HEARING ON THE OBAMA ADMINISTRATION'S CEQ RECENTLY REVISED DRAFT GUIDANCE FOR GHG EMISSIONS AND THE EFFECTS OF CLIMATE CHANGE,House Committee on Natural Resources,Policy
2015-04-22,INNOVATIONS IN SAFETY SINCE THE 2010 MACONDO INCIDENT,House Committee on Natural Resources,Fact Finding
2015-04-22,"OVERSIGHT HEARING ON THE OBAMA ADMINISTRATION'S PART 83 REVISIONS AND HOW THEY MAY ALLOW THE INTERIOR DEPARTMENT TO CREATE TRIBES, NOT RECOGNIZE THEM",House Committee on Natural Resources,Policy
2014-09-10,"LEGISLATIVE HEARING ON H.R. 5412, TO FACILITATE AND STREAMLINE THE BUREAU OF RECLAMATION PROCESS FOR CREATING OR EXPANDING SURFACE WATER STORAGE UNDER RECLAMATION LAW, ``BUREAU OF RECLAMATION SURFACE WATER STORAGE STREAMLINING ACT''",House Committee on Natural Resources,Policy
2014-09-10,"THE STATUS OF THE FISH AND WILDLIFE SERVICE'S RESPONSES TO COMMITTEE SUBPOENAS AND THE CONTINUED LACK OF TRANSPARENCY ABOUT ITS IMPLEMENTATION AND ENFORCEMENT OF AMERICAN WILDLIFE LAWS, AND OVERSIGHT OF THE DEPARTMENT OF THE INTERIOR'S SOLICITOR'S OFFICE",House Committee on Natural Resources,Policy
2014-07-29,"H.R. 596, ``PUBLIC LANDS RENEW- ABLE ENERGY DEVELOPMENT ACT OF 2013''; H.R. 1363, ``EXPLORING FOR GEOTHERMAL ENERGY ON FEDERAL LANDS ACT''; AND H.R. 2004, ``GEOTHERMAL PRODUCTION EXPANSION ACT OF 2013''",House Committee on Natural Resources,Legislative
2014-06-24,"OVERSIGHT HEARING ON NEW FEDERAL SCHEMES TO SOAK UP WATER AUTHORITY: IMPACTS ON STATES, WATER USERS, RECREATION AND JOBS",House Committee on Natural Resources,Fact Finding
2014-03-26,COLLISION COURSE: OVERSIGHT OF THE OBAMA ADMINISTRATION'S ENFORCEMENT APPROACH FOR AMERICA'S WILDLIFE LAWS AND ITS IMPACT ON DOMESTIC ENERGY,House Committee on Natural Resources,Policy
